Video_id,Category_id,Title,Description,url_default,Channel_id,Publish_time
6NYvOpFZLtM,27,Learn Seo and Social Media Marketing Services Skill &amp; Start Earning Online | Earn Money,Contact The Unlimited Skills: 03195590909 In this video we are going to talk about earning money online. So if you are interested ...,https://i.ytimg.com/vi/6NYvOpFZLtM/default.jpg,UCk_MJrrKXtTQRJKksOO0KyA,2023-06-03T15:52:19Z
g5uNnCoK3Pg,27,Using Social Media to Gain Work - Electrician,https://www.youtube.com/watch?v=ihmY5uDmlaE&t=499s podcast pricing Use code BUNDY25 at ...,https://i.ytimg.com/vi/g5uNnCoK3Pg/default.jpg,UCe1Taao1ibEdUqPtFPpb4Pg,2022-03-04T18:30:40Z
d4H90H_7vtU,27,Community Journalism: Social Media,"This is the second screencast from our FutureLearn Community Journalism course, showing you how to use social media ...",https://i.ytimg.com/vi/d4H90H_7vtU/default.jpg,UCE5QyTQXebPSK8Zcq_xTwUg,2014-03-28T14:05:04Z
aSHlQ5pNYDY,27,Social Media Marketing For Fashion Brands | Social Media Strategies For Clothing &amp; Fashion Brands,Let's discuss Social Media Marketing For Fashion Brands Styles come and go as quickly as trends on social media. Not only do ...,https://i.ytimg.com/vi/aSHlQ5pNYDY/default.jpg,UCRZhV5DzrHtm5u_guiMaxIQ,2022-12-25T11:00:01Z
d2fHcoc_jZ0,27,How to Generate Sales Through Social Media | SOCIAL MEDIA HACKS | DEEPAK BAJAJ,"If you want to boost your business to heights beyond imagination and master Social Media & Online Direct Selling from scratch, ...",https://i.ytimg.com/vi/d2fHcoc_jZ0/default.jpg,UCq5gIhlM7Vihj1ER1-SuE4A,2021-10-22T11:30:13Z
xxsAmcmkXRk,27,The Real Reason Daniel Radcliffe Won&#39;t Join Social Media,Massive Christmas Giveaway: https://www.instagram.com/p/CIyErtCpImB/?igshid=y5uwzh8s5eoo The Real Reason Daniel ...,https://i.ytimg.com/vi/xxsAmcmkXRk/default.jpg,UC-NINtNMPM75eaqh07RCy_Q,2020-12-14T21:00:11Z
1twQNGbj5aw,27,Polis Journalism Conference 2013: How to use social media for journalism,"Speakers: Yasmine El Rafie, Nadja Hahn Recorded on 5 April 2013 in the Wolfson Theatre, LSE. What can journalists do with ...",https://i.ytimg.com/vi/1twQNGbj5aw/default.jpg,UCK08_B5SZwoEUk2hDPMOijQ,2013-04-15T13:10:24Z
hlwMD3pDvTU,27,How To Start An Instagram Marketing Agency - Social Media Marketing Business,In this video I'm going to be talking about how you can create a social media marketing company where you make money from ...,https://i.ytimg.com/vi/hlwMD3pDvTU/default.jpg,UCc5pLvgFEsUQHDnoL0__btA,2020-11-03T18:45:01Z
hYD8BcqxrHQ,27,2022 Social media Trends | What is new on social media | How to grow your business online in 2022,"Social media keeps changing fast, audio marketing is here to stay, collaboration cannot be ignored, good Customer services is ...",https://i.ytimg.com/vi/hYD8BcqxrHQ/default.jpg,UCHhUTBwHXq6utdHfferRxxw,2021-12-27T10:39:42Z
KI135AO9epM,27,YorkTalks 2021: The role of social media in business innovation,"Professor Deborah Roberts (York Management School) delivers 2021 virtual YorkTalk, 'The role of social media in business ...",https://i.ytimg.com/vi/KI135AO9epM/default.jpg,UCNGHhdmMVZ_mc1lHLrDXWBg,2021-01-13T16:56:41Z
66mL3SAVEpU,27,Design &quot;JUST LISTED&quot; Real Estate Social Media Posts | Canva for Real Estate Agents,"Canva for Real Estate - In this tutorial, I show how to create two types of ""Just Listed"" real estate social media posts that are great ...",https://i.ytimg.com/vi/66mL3SAVEpU/default.jpg,UC0L15YBk8uqXbO-lTBG8wjg,2022-01-31T17:00:09Z
YkH4EHRm_Cg,27,Social Media Posts Can Get You Fired - Employment Lawyer Laura Noble Explains Why,"Laura Noble, the founder of the employment law firm The Noble Law, answers the question: can you be fired for what you post on ...",https://i.ytimg.com/vi/YkH4EHRm_Cg/default.jpg,UC846ddNuRHSUYwCT-4W6YZQ,2021-01-13T21:29:40Z
2upocf116R8,27,Social Media for Real Estate Agents - PERSONAL BRANDING for REALTORS 2021,Social Media for Realtors 2021. PERSONAL BRANDING for real estate agents is one of the most important aspects of building a ...,https://i.ytimg.com/vi/2upocf116R8/default.jpg,UCIZwIF-RyQxQNroTd5AFKNQ,2021-03-01T13:00:14Z
iHMjOYT76eQ,27,Social Media is impacting the Youth of India | Explained | Social media Vs Youth | StudyIQ IAS,Enrol to StudyIQ's Flagship UPSC IAS (Pre + Mains) LIVE Foundation Batch 9. Admissions closing on 10 DEC'22 | Enrol now ...,https://i.ytimg.com/vi/iHMjOYT76eQ/default.jpg,UCrC8mOqJQpoB7NuIMKIS6rQ,2022-09-03T11:00:11Z
MY2hfpp210I,27,Paying Social Media Jobs Review - Is It a Scam or Legit Online Jobs?,Paying Social Media Jobs review. Check out my FREE training  : https://freeaffiliatemarketingbusiness.com/course-lander/ This is ...,https://i.ytimg.com/vi/MY2hfpp210I/default.jpg,UCKQhnCgy6M9rwlEDmd8rang,2023-01-05T16:03:15Z
ntlv5wNmUIk,27,"How to Make Money from Social Media? | Earning from Youtube, Facebook &amp; Instagram",Get your SuperProfile: https://bit.ly/superprofilesignup Voucher Code: SUPER1 SuperProfile Help Videos: 1) How to add blocks ...,https://i.ytimg.com/vi/ntlv5wNmUIk/default.jpg,UCEAAzv2OBqxsSczKJ2QZyGQ,2023-01-01T04:30:11Z
U8LNrhUlS94,27,HOW TO USE SOCIAL MEDIA IN NETWORK MARKETING,HOW TO USE SOCIAL MEDIA IN NETWORK MARKETING ABOUT SOCIAL MEDIA KA ISTEMAL KAISE KARE. BASIC TIPS OF ...,https://i.ytimg.com/vi/U8LNrhUlS94/default.jpg,UCMFWcPSGp258RRXliycsvRw,2020-05-18T05:35:42Z
gBxQy3waqEI,27,How to Write the Best Captions for your Social Media Posts | For Beginner Social Media Manager [Eng],Hello Bosses! Are you struggling to make engaging captions for your clients? Here are the major components of an effective ...,https://i.ytimg.com/vi/gBxQy3waqEI/default.jpg,UCqOY9zsZrrd7MMYN-m8kcag,2021-05-06T15:15:17Z
s1m71BlGgr8,27,"GARY VEE ON THE FUTURE OF BUSINESS, SOCIAL MEDIA, VR &amp; NFTs.",Gary Vaynerchuk aka Gary Vee is undeniably one of the greatest entrepreneurs and visionaries over the past 20 years. He has ...,https://i.ytimg.com/vi/s1m71BlGgr8/default.jpg,UCRVsqvXIdgyPVS-a6fGa1lA,2021-02-23T22:00:10Z
Ta6qq7wnpcA,27,Cyber Sandra&#39;s Hacks - Social Media Impersonation,"Friends don't scam friends. But how can you tell a legit friend request apart from an impersonation scam? Let Cyber Sandra help, ...",https://i.ytimg.com/vi/Ta6qq7wnpcA/default.jpg,UClG3Wm4UIiNrHFVNY10ebmg,2021-06-04T02:30:43Z
0oay5t5IS9s,27,Keeping Social Media Real in 140 Seconds - Parent&#39;s Edition,"In partnership with the Arlington Independent School District, APD has produced a video, ""Keeping Social Media Real in 140 ...",https://i.ytimg.com/vi/0oay5t5IS9s/default.jpg,UCuQYuhkwOTcWnyJlTLIa9OQ,2016-02-10T15:46:49Z
73HTZ3FzyKk,27,Benefits of Social Media Marketing in 2022 | Advantage and Disadvantage of Social Media Marketing,In this Digital Gaurav share Advantage and Disadvantage of Social Media Marketing Video include 1. Advantages of Social Media ...,https://i.ytimg.com/vi/73HTZ3FzyKk/default.jpg,UC9fQzJluWVDfUZuIvba81-g,2022-02-03T15:22:16Z
ujhTbI1tuuA,27,Kid Has 500 Friends on Social Media - Online Safety for Kids - Read Aloud Children&#39;s Books,Watch the newest video https://www.youtube.com/playlist?list=UUOqnAEejGqVwzTBOVz9DhZA&playnext=1&index=1 Watch ...,https://i.ytimg.com/vi/ujhTbI1tuuA/default.jpg,UCOqnAEejGqVwzTBOVz9DhZA,2020-09-18T14:00:13Z
9QcLmIJtXxI,27,3 Skills You Need to Become a Social Media Strategist - Stratford Career Institute,Have you considered a social media strategist career? Stratford Career Institute is proud to offer a comprehensive online course ...,https://i.ytimg.com/vi/9QcLmIJtXxI/default.jpg,UCe-AK6odsK469nidsu8bkAw,2020-04-16T21:21:15Z
AshTPy3pa5I,27,"Speech on Social media in English | Social media boon or bane, advantages and disadvantages",Read this essay on our website at : https://smilepliz.com/speech-on-social-media #speechonsocialmedia #socialmediaspeech ...,https://i.ytimg.com/vi/AshTPy3pa5I/default.jpg,UCEeqSP81Aav5Zvbdc1RvnAQ,2020-06-29T13:19:40Z
tlvwl4BFJ6M,27,"Audiobook - Social media marketing :Instagram Marketing,Tiktok &amp; You Tube Marketing - Dave Miller","Audiobook - Social media marketing 3 Books in One: Excellent tricks to grow your business ,Instagram Marketing to Become a ...",https://i.ytimg.com/vi/tlvwl4BFJ6M/default.jpg,UCS9V38XRcK6WQ_cnSGV2vWg,2022-10-11T15:02:00Z
z4ficyzWDJ4,27,How to Promote Business on Social Media for FREE | Social Media Marketing Tips and Tricks #SMM,In this video you will know how to promote your brand and products using Social Media. You can also learn complete digital ...,https://i.ytimg.com/vi/z4ficyzWDJ4/default.jpg,UCZbdK5v2VIj7qG6s7y3nDdw,2022-05-29T10:30:08Z
8OCVKeINyp0,27,The Role of Social Media in the Hospitality Sector,"Hotel and travel companies need to understand that today's skeptical customers see straight through biased marketing efforts, ...",https://i.ytimg.com/vi/8OCVKeINyp0/default.jpg,UCt4W_4WXz9DQ7H_wc-j0Rfg,2011-04-08T08:21:03Z
4S5hT_nNx_M,27,Episod Special Mind Architect x Dove - Impactul Social Media asupra copiilor și adolescenților,Trăim într-o lume în care mediul online e din ce in ce mai accesibil și de la vârste tot mai fragede. Copiii și adolescenții de astăzi ...,https://i.ytimg.com/vi/4S5hT_nNx_M/default.jpg,UCA3_KLo1kLH5oXrW2JkzVpQ,2021-06-16T08:45:00Z
U8LNrhUlS94,27,HOW TO USE SOCIAL MEDIA IN NETWORK MARKETING,HOW TO USE SOCIAL MEDIA IN NETWORK MARKETING ABOUT SOCIAL MEDIA KA ISTEMAL KAISE KARE. BASIC TIPS OF ...,https://i.ytimg.com/vi/U8LNrhUlS94/default.jpg,UCMFWcPSGp258RRXliycsvRw,2020-05-18T05:35:42Z
653qpwoAsCY,27,Social Media: Real Connection or the Illusion of Communication?,"For more on this event, visit: https://bit.ly/3pvMczg For more on the Georgetown Initiative on Catholic Social Thought and Public ...",https://i.ytimg.com/vi/653qpwoAsCY/default.jpg,UCpcqQEMFgjSo1A_7wfPiyKQ,2021-12-03T18:35:12Z
NAgR_8R32Rw,27,What is Social Media? | What is Social Media Marketing in Hindi | Social Media Marketing Full Course,"As we have started social media marketing course, so it is important to know what is social media and its importance for ...",https://i.ytimg.com/vi/NAgR_8R32Rw/default.jpg,UCZbdK5v2VIj7qG6s7y3nDdw,2022-01-31T11:45:01Z
3Q2-Js0oqaE,27,"Social Media Marketing for Business, Instagram post schedule &amp; more | Growth Insights #11","Welcome back to Growth Insights, in this episode we're looking at Social Media Marketing for Business, Instagram post schedule ...",https://i.ytimg.com/vi/3Q2-Js0oqaE/default.jpg,UCj6owuAZrJNsjQzc2ZtILIw,2018-02-28T09:15:56Z
wotiwP72WCI,27,The SECRET to kill your social media addiction for GOOD,"If you think this video is too long, that's a sign of your damaged attention span I designed this video to transform your mindset; ...",https://i.ytimg.com/vi/wotiwP72WCI/default.jpg,UCb9fs9s67BXlX7rXVzRf5cQ,2024-04-06T14:00:43Z
iCuTwqd4wJM,27,social media पर famous होने के आसान तरीके | best inspirational video by Mahendra Dogney #shorts,social media पर famous होने के आसान तरीके | best inspirational video by Mahendra Dogney #shorts In this video ...,https://i.ytimg.com/vi/iCuTwqd4wJM/default.jpg,UCLLJt2t6WYpxWktsl1e429Q,2022-11-01T11:30:10Z
LEn516nKnlQ,27,How to add social media links to your Google business profile? A simple and complete guide - Localo,Want to make your company's social media profiles visible in your Google business profile (formerly known as Google My ...,https://i.ytimg.com/vi/LEn516nKnlQ/default.jpg,UCJaQ0FEVCsSTgaTzBY7iDsA,2022-04-04T08:00:36Z
TqU11-Gfg_8,27,How to Become a Social Media Influencer and Make Money,Want to start a business as a social media influencer? Here's how: ...,https://i.ytimg.com/vi/TqU11-Gfg_8/default.jpg,UC-hfd-zO8SSMpOgLNYwLAXA,2022-02-02T19:51:06Z
DdjteBSbHBY,27,Real Estate Business Models with Social Media | Mega Agent Camp 2022,Promoting your real estate business on social media is a prime place to prospect and generate leads. With so many clients using ...,https://i.ytimg.com/vi/DdjteBSbHBY/default.jpg,UCxViDXGTXVVfgLQJZUquM7A,2022-08-24T13:03:06Z
Ap58hhCE5rQ,27,3 Ai Tools to Make Profitable Business | New Age Ai Social Media Business,"Make Startup Funds Using Ai in 16 Mins | Unlocking Full Ai Potential To Make Money, How to make money using ai generated ...",https://i.ytimg.com/vi/Ap58hhCE5rQ/default.jpg,UCOrS4ObeJ08FmsVG9Fwhmsg,2023-02-04T14:30:05Z
JLJdVN1Ry2Q,27,The Real Estate Social Media Strategy for Maximum Reach and Engagement | #TomFerryShow,"In this episode of the #TomFerryShow, I'm tackling one of the most asked questions I hear: What should I be doing on social ...",https://i.ytimg.com/vi/JLJdVN1Ry2Q/default.jpg,UC3ZAfS1Z3J_Itfy7Rp745cg,2018-03-13T11:00:00Z
2m39uAs8l78,27,2022 NEW SOCIAL MEDIA MARKETING PART 1 of 5 in SPANISH,For our latest videos - sort from newest to oldest! We strive to always offer Simply More with MIAMI! #miamitrainers #miamirealtors ...,https://i.ytimg.com/vi/2m39uAs8l78/default.jpg,UCmpfCl3Ky8lfpITifNRl11w,2022-03-10T22:48:17Z
_mq7bgIMeUk,27,How to Use Meme Marketing in Business | Social Media Marketing Strategy in Hindi | Career Yatra,Watch Our 1Min Business Contents : https://bit.ly/3sgCiUR Timestamp : 00:00 - Introduction to Meme Marketing 00:55 - How ...,https://i.ytimg.com/vi/_mq7bgIMeUk/default.jpg,UCDZPlN6Mfj1eDBD7LY9GcrA,2022-03-20T06:35:00Z
lLHvOaD1uQY,27,how to manage all social media at one place | Free Tools | Publer,"From creating and publishing content to analytics and reporting, it can be pretty overwhelming to think of all the jobs social media ...",https://i.ytimg.com/vi/lLHvOaD1uQY/default.jpg,UCzePn3TVl1TCSOTLfukLMEw,2021-06-01T16:28:02Z
2_mDQJ3-0ps,27,"Beware of Latest Social Media Scams | Email Phishing, Instagram, Facebook, Telegram Scams",Start Investing in Stock Market Open a Free Demat Account on Angel Broking: https://bit.ly/AngelOffer Open a Free Demat ...,https://i.ytimg.com/vi/2_mDQJ3-0ps/default.jpg,UCEAAzv2OBqxsSczKJ2QZyGQ,2023-05-21T06:00:08Z
MYqLNjfmgEM,27,Award Winning Mime Show II On Social Media &amp; Mental Health,"The mime show, performed by students from the Department of Social Work, Government First Grade College, Uppinangady, ...",https://i.ytimg.com/vi/MYqLNjfmgEM/default.jpg,UCZgefoQMWODA9zfIK7caVyQ,2023-06-25T09:07:17Z
_Woc-NXdMSs,27,"Download Bar Codes, QR Codes, Social Media Icons, Transparent Icons (FREE)","Download all your graphic design needs from one website, Grab it now ! https://1.envato.market/c/2655300/1159027/4662 ...",https://i.ytimg.com/vi/_Woc-NXdMSs/default.jpg,UC53Fnr1rJc62f9IJg8h5CiA,2020-09-09T07:59:31Z
wFFW7nLCrHs,27,How to Create a High Impact Social Media Strategy for Your Business,http://www.docstoc.com/youtube - Click to Download 25000+ Business Forms & Templates! How to Create a High Impact Social ...,https://i.ytimg.com/vi/wFFW7nLCrHs/default.jpg,UCz7gM4XmSZmL3vwRkUkb7UA,2011-12-08T17:56:21Z
dH2Qfjj7zkE,27,How To Boost Your Ecommerce Business with Effective Social Media Content,How to increase your dropshipping sales with proven content marketing strategies and maximize your income via engaging social ...,https://i.ytimg.com/vi/dH2Qfjj7zkE/default.jpg,UC7geKfz2-IH0rsgRBtHTm0g,2023-01-31T19:52:33Z
t8WQ5lOot8c,27,The Best Social Media Strategy for Realtors 2022 | Tamil | தமிழில் | @TheRealEstateEntrepreneur,socialmediastrategy #realestatebusiness #therealestateentrepreneur In this video you will learn about the best social media ...,https://i.ytimg.com/vi/t8WQ5lOot8c/default.jpg,UCXNDznZfmwU_gJMpG9zJ0xQ,2022-01-30T05:41:13Z
s6CtRsVpok0,27,New Real Estate Agent SUCCESS BLUEPRINT - kvCORE Lead Generation &amp; Social Media,Are you a NEW REALTOR looking to CRUSH IT? This video gives you the blueprint of how to become a successful real estate ...,https://i.ytimg.com/vi/s6CtRsVpok0/default.jpg,UCIZwIF-RyQxQNroTd5AFKNQ,2021-01-25T13:00:10Z
ei1zXpLO0hU,27,How to use Facebook ad for business? - Food Business | Social Media Marketing | Cloud Kitchen,How to use Facebook ad for business? - Food Business | Social Media Marketing | Cloud Kitchen Facebook ads keep your ...,https://i.ytimg.com/vi/ei1zXpLO0hU/default.jpg,UCNW_gAZmvml9-FE2f2x-a2A,2021-10-25T13:52:35Z
0W6k27tut2A,27,Social Media Policies are Not the Real Issue,"Gabe Schneider, Kendra Pierre-Louis, Sisi Wei and Karen Ho in a discussion around how newsrooms can work to become ...",https://i.ytimg.com/vi/0W6k27tut2A/default.jpg,UCu_GkwzuHVLH1dQGvQ2AzaA,2021-03-23T17:16:04Z
hlwMD3pDvTU,27,How To Start An Instagram Marketing Agency - Social Media Marketing Business,In this video I'm going to be talking about how you can create a social media marketing company where you make money from ...,https://i.ytimg.com/vi/hlwMD3pDvTU/default.jpg,UCc5pLvgFEsUQHDnoL0__btA,2020-11-03T18:45:01Z
TDSdkxz3xoI,27,Social Media in Business,"In this edition of Smith Business Close-Up with the University of Maryland's Robert H. Smith School of Business, William Rand, ...",https://i.ytimg.com/vi/TDSdkxz3xoI/default.jpg,UCljSqREYsADK1Tw4CAaFaPQ,2011-09-01T16:16:29Z
iIPf_-GKApA,27,How to SCHEDULE social media POSTS directly from Canva (PRO),Try out the Planner + ALL the other Canva PRO features for FREE for 30 days: https://bit.ly/FREECanvaPRO30days Link to ...,https://i.ytimg.com/vi/iIPf_-GKApA/default.jpg,UCoAVxHBNK52DksuzSs5e4jw,2020-08-31T14:00:10Z
nEDfmBQ5CEo,27,How to GET STARTED on Social Media for Real Estate Agents (2021),"Want to know EXACTLY how to get started on Social Media for Real Estate Agents in 2021? I break down BEST PRACTICES, do's ...",https://i.ytimg.com/vi/nEDfmBQ5CEo/default.jpg,UCIZwIF-RyQxQNroTd5AFKNQ,2020-09-22T12:00:12Z
GgP941_Cixg,27,Real Estate Post Design for Social Media in Canva (Speed Art),RealEstatePostDesignForSocialMediaInCanva | #RealEstatePostDesign | #SocialMediaPostDesign ...,https://i.ytimg.com/vi/GgP941_Cixg/default.jpg,UCTgb6C8LtH5LJul2sE2ywbg,2022-03-28T12:36:18Z
Xukr3Tmglow,27,"Don&#39;t Be Jealous of Social Media, Roys Bedoys! - Read Aloud Children&#39;s Books",Watch the newest video https://www.youtube.com/playlist?list=UUOqnAEejGqVwzTBOVz9DhZA&playnext=1&index=1 Watch ...,https://i.ytimg.com/vi/Xukr3Tmglow/default.jpg,UCOqnAEejGqVwzTBOVz9DhZA,2023-12-23T12:01:01Z
d2fHcoc_jZ0,27,How to Generate Sales Through Social Media | SOCIAL MEDIA HACKS | DEEPAK BAJAJ,"If you want to boost your business to heights beyond imagination and master Social Media & Online Direct Selling from scratch, ...",https://i.ytimg.com/vi/d2fHcoc_jZ0/default.jpg,UCq5gIhlM7Vihj1ER1-SuE4A,2021-10-22T11:30:13Z
Yt1Q7goYhng,27,Is Social Media The Best Place To Market Your Business?,"Is social media the best place to market your business? Obviously I'm a big fan of social media, but it's not the best option for all ...",https://i.ytimg.com/vi/Yt1Q7goYhng/default.jpg,UC5i1U95Udd4RYblltKRV9-A,2021-11-25T13:00:13Z
iHMjOYT76eQ,27,Social Media is impacting the Youth of India | Explained | Social media Vs Youth | StudyIQ IAS,Enrol to StudyIQ's Flagship UPSC IAS (Pre + Mains) LIVE Foundation Batch 9. Admissions closing on 10 DEC'22 | Enrol now ...,https://i.ytimg.com/vi/iHMjOYT76eQ/default.jpg,UCrC8mOqJQpoB7NuIMKIS6rQ,2022-09-03T11:00:11Z
-LGXkpl0FLI,27,COMPLETE Social Media Marketing Plan for Real Estate Agents,"COMPLETE Social Media Marketing Plan for Real Estate Agents on EVERY PLATFORM, including exactly what facebook lead ...",https://i.ytimg.com/vi/-LGXkpl0FLI/default.jpg,UCIZwIF-RyQxQNroTd5AFKNQ,2020-06-27T13:00:00Z
-6hXBtkki2M,27,Tips to Quickly Master Social Media for Business,Help-full English for day to day life - Tips to Quickly Master Social Media for Business Watch more Videos at ...,https://i.ytimg.com/vi/-6hXBtkki2M/default.jpg,UCVLbzhxVTiTLiVKeGV7WEBg,2020-11-26T05:31:58Z
_tgyNHdlJZY,27,Keeping Social Media Real in 60 Seconds,"In partnership with the Arlington Independent School District, APD has produced a video, ""Keeping Social Media Real in 60 ...",https://i.ytimg.com/vi/_tgyNHdlJZY/default.jpg,UCuQYuhkwOTcWnyJlTLIa9OQ,2016-02-10T15:44:46Z
xHffH-uPeAQ,27,Managing social media in our business - The MAC,"The MAC (Metropolitan Arts Centre) is Belfast's newest arts venue. Ciaran Corr, Media and Communications officer from The MAC ...",https://i.ytimg.com/vi/xHffH-uPeAQ/default.jpg,UCPaw-eoZzY6ltSYHo5W-MWw,2014-04-17T13:41:44Z
_u8xs1dxvgI,27,How To Create Social Media Content Calendar in Just 5 Minutes,"Are you struggling to keep up with the ever-changing trends on social media? In this video, I'm going to show you a foolproof way ...",https://i.ytimg.com/vi/_u8xs1dxvgI/default.jpg,UCSVfBuOy60k4tWLlS5HAXYQ,2023-01-09T06:56:29Z
6psa3T7z0Uo,27,How To Get orders of FACEBOOK PAGE Management | Social Media Management Jobs,"How To Get orders of FACEBOOK PAGE Management | Social Media Management Jobs In this video, I have explained how you ...",https://i.ytimg.com/vi/6psa3T7z0Uo/default.jpg,UCC_ycdL5_Rw9b6UEmtmUE3g,2022-06-25T13:17:47Z
OvVhcfFHXWg,27,Don&#39;t Stress Over Social Media and Don&#39;t Compare Your Business To The Competition by OPEN Forum,"For more info, please visit: http://www.openforum.com/yourbusinesstv Each week MSNBC's Your Business features experts to ...",https://i.ytimg.com/vi/OvVhcfFHXWg/default.jpg,UCAD48STRxYJVIfjHTZU7zIg,2013-08-21T18:04:48Z
GuCMvsfNGmc,27,Paid social media | Google Digital Marketing &amp; E-commerce Certificate,This video is part of the Google Digital Marketing & E-commerce Certificate. If you're curious about the latest trends in technology ...,https://i.ytimg.com/vi/GuCMvsfNGmc/default.jpg,UC_fyAp919RnkKmBrMXGwnUQ,2022-05-31T16:00:06Z
eYf4iBIRuv8,27,Stephan Seiler: What is Social Media Marketing Really Worth?,Stanford Graduate School of Business.,https://i.ytimg.com/vi/eYf4iBIRuv8/default.jpg,UCGwuxdEeCf0TIA2RbPOj-8g,2016-08-08T23:33:36Z
zsurrA3usEs,27,How Social Media Could END Your Business #Shorts,How Social Media Could END Your Business #Shorts ▻▻ 4 Steps to Earn $1000/mo of Passive Income In Just 30 Minutes A Day ...,https://i.ytimg.com/vi/zsurrA3usEs/default.jpg,UCaYelLPxZmcZfS5Xq8hyVRA,2021-09-27T13:59:36Z
CQSvLw-wsz0,27,How To Win On Social Media In 2023!,socialmedia #business #marketing — The home of all @garyvee videos All posts by @teamgaryvee ▻ Check out my main ...,https://i.ytimg.com/vi/CQSvLw-wsz0/default.jpg,UCOEMEjL1GBJ41uCWur5VXWQ,2023-02-09T13:00:07Z
7ysur878g38,27,Social Media for Real Estate Q&amp;A - Open House Episode 6,In this episode of Open House we answer your viewer submitted questions! Including… • What are Hashtags & how do I use ...,https://i.ytimg.com/vi/7ysur878g38/default.jpg,UCnCRkTW9M3LyWkjBFuKbpRA,2021-06-07T15:54:26Z
g5l2QlRomA8,27,How Social Media Affects your Mental Health,"Social media has become so engraved in our day-to-day life, it actually seems strange if you meet someone who doesn't have ...",https://i.ytimg.com/vi/g5l2QlRomA8/default.jpg,UCuyeGU_keSOy_6Cbe9rbR4A,2021-07-04T14:00:24Z
_7fD6pDVVoY,27,Social Media Marketing in Kannada | Social Media Marketing Basics,"Learn about Social Media Marketing in Kannada. In this video, you will learn about Social Media Marketing Basics such as What ...",https://i.ytimg.com/vi/_7fD6pDVVoY/default.jpg,UCTp_NcrHkWKpJdAzLWfCuZg,2021-06-24T14:34:46Z
4MjNFG95zJE,27,Social Media Plan Explained - Why does your business need a social media plan,"Firms do not want to go blindly into the social media world, they should develop a social media plan which helps them set ...",https://i.ytimg.com/vi/4MjNFG95zJE/default.jpg,UCZT_Vg3DwREDlz11aeWe8FQ,2020-07-17T12:00:03Z
1_8pxAi603k,27,How To Transition A Social Media Connection To A Sale #sales #salespeople #success #business,"sandlerworldwide #sandler In today's fast-paced digital world, social media has become an indispensable tool for businesses to ...",https://i.ytimg.com/vi/1_8pxAi603k/default.jpg,UCCQWK23LzxjGQjQmYxHq1kA,2023-03-15T20:31:44Z
0yIsosyQ6FQ,27,Social Media Agency Tutorial | 7 effective ways to work with clients (Tamil),"Registrations open for the Course in Tamil, ""Social Media Marketing Masterclass"" Follow me on Instagram ...",https://i.ytimg.com/vi/0yIsosyQ6FQ/default.jpg,UCfbFRFzVRXh_zONarM7NTHg,2020-12-11T13:09:38Z
ms9rkLYWFtw,27,#ASKKIM: Social Media For Business - What&#39;s The Best Social Media Platform For Business?,"Social Media for business can be quite confusing, which is precisely why in this week's episode, I'm answering a question I get ...",https://i.ytimg.com/vi/ms9rkLYWFtw/default.jpg,UCOragOBgnQUNAZr8xPHwm3A,2019-10-23T18:36:01Z
clmaVYcclnc,27,What is Social Media Marketing in Tamil | How to Become a Social Media Manager for Beginners | Oviya,"What is Social Media Marketing in Tamil. How to Become a Social Media Manager for Beginners. Hi Everyone, In this video, ...",https://i.ytimg.com/vi/clmaVYcclnc/default.jpg,UC3tcI09gyed0WW40homszPQ,2021-03-25T15:00:10Z
wotiwP72WCI,27,The SECRET to kill your social media addiction for GOOD,"If you think this video is too long, that's a sign of your damaged attention span I designed this video to transform your mindset; ...",https://i.ytimg.com/vi/wotiwP72WCI/default.jpg,UCb9fs9s67BXlX7rXVzRf5cQ,2024-04-06T14:00:43Z
J6Ktwr6OGoA,27,How to Add Social Media Links to Your Google Business Profile,We'll teach you how to take your Google Business profile to the next level by adding social media links in this educational video.,https://i.ytimg.com/vi/J6Ktwr6OGoA/default.jpg,UCy_jvpycdMgl3gwLehI_xrA,2023-05-11T10:06:28Z
Ap58hhCE5rQ,27,3 Ai Tools to Make Profitable Business | New Age Ai Social Media Business,"Make Startup Funds Using Ai in 16 Mins | Unlocking Full Ai Potential To Make Money, How to make money using ai generated ...",https://i.ytimg.com/vi/Ap58hhCE5rQ/default.jpg,UCOrS4ObeJ08FmsVG9Fwhmsg,2023-02-04T14:30:05Z
-6hXBtkki2M,27,Tips to Quickly Master Social Media for Business,Help-full English for day to day life - Tips to Quickly Master Social Media for Business Watch more Videos at ...,https://i.ytimg.com/vi/-6hXBtkki2M/default.jpg,UCVLbzhxVTiTLiVKeGV7WEBg,2020-11-26T05:31:58Z
