Video_id,Category_id,Title,Description,url_default,Channel_id,Publish_time
PnsDzQdeiNI,27,Real Estate Banner Design for Social Media post in Picsart 2021 | BannerDesign,Hello Dosto.... My new tutorial Real Estate Banner Design for Social Media post in Picsart 2021 Please SUBSCRIBE and hit the ...,https://i.ytimg.com/vi/PnsDzQdeiNI/default.jpg,UCTnim9dGy36a0czAEtTsyTA,2021-09-14T10:31:19Z
SpF9d6djACo,27,The Sound of Business: Social Media,Tune in to the Sound of Business to hear from successful Canadian entrepreneurs and industry experts as they share their ...,https://i.ytimg.com/vi/SpF9d6djACo/default.jpg,UCi4ie2vwCvR2xv7jdFNBxSA,2017-07-28T13:34:40Z
3fPCkbc34HI,27,My Press Conference On Sandeep Maheshwari | Dr Vivek Bindra,Dr Vivek Bindra breaks silence over the long running Sandeep Maheshwari Vs Dr Vivek Bindra controversy. Dr Vivek Bindra ...,https://i.ytimg.com/vi/3fPCkbc34HI/default.jpg,UCR-foyF-C6VuAlwy3KZMkgA,2024-04-09T15:17:17Z
fm6zVMGcx1o,27,Can you Scale your Business with Social Media?,Can you Scale your Business with Social Media? By Mike Pitt. This is video number 496 ✓ Subscribe to my channel here ...,https://i.ytimg.com/vi/fm6zVMGcx1o/default.jpg,UCR6AQNBO0AKTu7p8tV9rSBQ,2021-07-20T17:59:04Z
BmDI5Dcpdw0,27,Poti adauga linkuri Social Media in Google My Business Profile,"Ghici unde poti sa pui link catre retele tale sociale? In Google Businss Manager! Adica in acea zona care descrie compania ta, ...",https://i.ytimg.com/vi/BmDI5Dcpdw0/default.jpg,UCukSFHzKbFu1OZeKYkYHhZQ,2024-04-09T15:30:02Z
9QpcjmHDts0,27,Social Media für Selbstständige &amp; Unternehmer | Social Media Marketing für dein Unternehmen,Welche Social Media Kanäle sollte Ich nutzen? Was ist Social Media Marketing? Welche Social Media Kanäle gibt es alles?,https://i.ytimg.com/vi/9QpcjmHDts0/default.jpg,UCE8jjFWf47WlOWJMEbKk2Vw,2022-12-28T18:00:03Z
ELEf0f0BOxc,27,Real Estate Social Media Post Design in Photoshop,"Learn how to create Real Estate Banner or Social Media Post Design in Photoshop. If you enjoyed this video, please leave a LIKE ...",https://i.ytimg.com/vi/ELEf0f0BOxc/default.jpg,UCOWw0B8iNoYizk-v386-q8w,2022-09-26T14:03:20Z
m_WapLXKYe8,27,Become the Real Estate Thought Leader on Social Media | This Week in Marketing,"What does it take to be the real estate thought leader in your area? You need to help dispel misinformation, ease fear, and ...",https://i.ytimg.com/vi/m_WapLXKYe8/default.jpg,UC3ZAfS1Z3J_Itfy7Rp745cg,2023-03-27T11:30:15Z
QpTEv-MsW5U,27,50+ Real Estate House Property Social Media Post Photoshop Tutorial Part 1,Graphics Wonderland Channel Provide Free Templates with Tutorials You Can Get More Other Graphics Data For Personal Use.,https://i.ytimg.com/vi/QpTEv-MsW5U/default.jpg,UCOsuSCvTqVbtV0ucC_voYBw,2023-03-14T03:06:46Z
OrHnjtMj86s,27,How to draw social media addicted/over use. deep meaningful video step by step,About video : How to draw social media addicted /overuse .deep meaningful video step by step ▭▭▭▭▭ ▻ Used things ...,https://i.ytimg.com/vi/OrHnjtMj86s/default.jpg,UCx0lCVjkEgqZkJSMTrEmzkA,2020-04-28T14:45:12Z
g28WWjbCN98,27,How to do Branding on Social Media | How to use Social Media for Branding | #socialmediabranding,In this video you will learn how to do branding using social media and how to grow yourself or your business with the power of ...,https://i.ytimg.com/vi/g28WWjbCN98/default.jpg,UCZbdK5v2VIj7qG6s7y3nDdw,2022-06-24T04:13:42Z
maOSVl-ELRA,27,NZF Ramadan Real Talk | Episode 4 - Unfiltered: Social Media and Muslims in the Influencer Age,NZF Ramadan Real Talk | Episode 4 - Unfiltered: Social Media and Muslims in the Influencer Age Social media. We use it ...,https://i.ytimg.com/vi/maOSVl-ELRA/default.jpg,UCqqi7_QPE1yZBgP8jjXIysw,2022-04-15T00:39:30Z
HHlcjpXECSo,27,"Geordie Shore, Social Media, Business and More! Podcast w/Bethan Kershaw","Bethan Kershaw Interview 2020 - Geordie Shore, Business and More // Today I got to sit down with Geordie Shore cast member ...",https://i.ytimg.com/vi/HHlcjpXECSo/default.jpg,UC0IFoR54k1EFL4otIyp3JnQ,2019-12-10T10:45:46Z
5CcEVK04IRo,27,Real Estate Post Mockup In Photoshop | Social Media Post Design,"Real Estate Post Mockup In Photoshop | Social Media Post Design In this video, you will learn how to make real estate post ...",https://i.ytimg.com/vi/5CcEVK04IRo/default.jpg,UCJIDw2bP2VfZbskG2FMp8kw,2022-11-17T12:37:13Z
OP30V-d54vQ,27,Mental Health Tips: Social Media vs Real Life | AAP #shorts,"The reality is, there can be a big difference between what we see on Instagram and what our lives look like.” Pediatrician Rebekah ...",https://i.ytimg.com/vi/OP30V-d54vQ/default.jpg,UClR8YIQX5Fb8J2wmsUKLhvQ,2022-11-23T15:18:12Z
JyJd111Ym7U,27,Arvind Kejriwal Jailed! | DICTATORSHIP Confirmed? | Dhruv Rathee,Extension of the Happy Holi sale! Link to Dhruv Rathee Academy here: https://academy.dhruvrathee.com/home Use Code: ...,https://i.ytimg.com/vi/JyJd111Ym7U/default.jpg,UC-CSyyi47VX1lD9zyeABW3w,2024-04-01T16:16:30Z
RJJCSoS7tB4,27,What is Social Media Engagement? | How to Increase Social Media Engagement for Business #SocialMedia,In this video you will learn what is social media engagement? and ways to increase your social media engagement for your ...,https://i.ytimg.com/vi/RJJCSoS7tB4/default.jpg,UCZbdK5v2VIj7qG6s7y3nDdw,2022-02-10T07:56:01Z
mooihFJcAiQ,27,SOCIAL MEDIA DEFINITION AND ITS TYPES || CUET MASS COMMUNICATION DOMAIN || MASS MEDIA STUDIES,,https://i.ytimg.com/vi/mooihFJcAiQ/default.jpg,UCg359R4TDU_8Ha-F3T5LRyg,2023-04-18T08:29:59Z
ZhU_jTIBvyk,27,[FREE] 7 Day Social Media Marketing Training | Webinar | Malayalam | Facebook for Business Growth,"Create Razorpay account and receive ₹1,00000 in collections without commission https://referral.razorpay.com/h79xzxx7 ...",https://i.ytimg.com/vi/ZhU_jTIBvyk/default.jpg,UC_R7a_Drp3gDdp-w7OITBtg,2020-07-19T05:51:05Z
_Ex7zEybGtA,27,Real Estate Banner Design in Photoshop  |  Social Media Post Design,Real Estate Banner Design in Photoshop | Social Media Post Design .,https://i.ytimg.com/vi/_Ex7zEybGtA/default.jpg,UC1zuvQ2jbeNJb5u6LyhpBHA,2021-05-27T04:00:21Z
_2BXVEADX-E,27,Social Media Star IAS Officer Suspended | Real Reason Explained | Gaurav Kaushal,Android App Link: https://play.google.com/store/apps/details?id=com.gaurav.kaushal&pli=1 iOS App Link: ...,https://i.ytimg.com/vi/_2BXVEADX-E/default.jpg,UCK3EVU3QjQoFoz9if2LK5aQ,2023-02-10T10:04:13Z
ziQ3jPq9AoI,27,Social Media Monitoring - Social Media Analytics - Deutsch,Social Media Monitoring und Social Media Analytics mit Social Searcher ein Social Media Tool unter: https://goo.gl/ew8YHf ...,https://i.ytimg.com/vi/ziQ3jPq9AoI/default.jpg,UCoIDJLc-HVH4Gulb2qvC00w,2017-02-21T07:17:46Z
6SCSmpd7Meo,27,"Digital Marketing for Solar Companies, Dealers/Distributors | Social Media, SEO, &amp; Lead Generation","If you are a solar dealer, distributor, or solar panel manufacturing company then this video is especially for you. If you are looking ...",https://i.ytimg.com/vi/6SCSmpd7Meo/default.jpg,UCjiXru6QU56trA7DOuCs7KQ,2022-08-02T10:06:22Z
ziQ3jPq9AoI,27,Social Media Monitoring - Social Media Analytics - Deutsch,Social Media Monitoring und Social Media Analytics mit Social Searcher ein Social Media Tool unter: https://goo.gl/ew8YHf ...,https://i.ytimg.com/vi/ziQ3jPq9AoI/default.jpg,UCoIDJLc-HVH4Gulb2qvC00w,2017-02-21T07:17:46Z
6SCSmpd7Meo,27,"Digital Marketing for Solar Companies, Dealers/Distributors | Social Media, SEO, &amp; Lead Generation","If you are a solar dealer, distributor, or solar panel manufacturing company then this video is especially for you. If you are looking ...",https://i.ytimg.com/vi/6SCSmpd7Meo/default.jpg,UCjiXru6QU56trA7DOuCs7KQ,2022-08-02T10:06:22Z
e118TeJIiRg,27,IAMON Indian Social Media | IAMON Business Plan | IAMON Plan | IAMON Real Or Fake | Kanak Institute,Aaj ke is video me IAMONE App ke bare me bat karenge jo khud ko social media app ke name se advertisment karti hai. Ye MLM ...,https://i.ytimg.com/vi/e118TeJIiRg/default.jpg,UCfjhpSwOH_uud_KywGL4S4g,2020-11-07T05:02:28Z
cTz1bLA1sYs,27,Jewelry  Social Media Banner or Product Design | Illustrator Tutorial | J A SAKIB,Today You will learn how to design Jewelry Banner or Social Media Post in Adobe Illustrator. Enjoy the video and let me know ...,https://i.ytimg.com/vi/cTz1bLA1sYs/default.jpg,UCgxX2xdVuQzFqHRlrxYxbhw,2021-12-03T14:06:31Z
gSw8jx0kDr8,27,Social Media Banner Design in PowerPoint Hindi Tutorial,"adrealtech #Powerpointtutorial #socialmediabannerdesign Hello everyone, welcome to my channel. AD Real Tech brings you ...",https://i.ytimg.com/vi/gSw8jx0kDr8/default.jpg,UC01sCa22i8CVRRUaXCZ2Ybg,2021-12-08T12:30:09Z
FDz_Ejr329Q,27,Maa Bartan Dho Rahi Hai Aur Beta Social Media Ka Champion Bana Baitha Hai,Open DEMAT ACCOUNT Click On Link https://upstox.com/open-account/?f=403X Ameer e Shariyat Islamic Scholar Motivational ...,https://i.ytimg.com/vi/FDz_Ejr329Q/default.jpg,UCeQzYquf0UGzTkB8QmjVRbA,2021-02-02T16:30:44Z
hKnbSZ3uNgU,27,Can The Next Billion Dollar Social Media Platform Be Black Owned?,"In this enlightening episode of Earn Your Leisure, we delve deep into the groundbreaking journey of Fanbase, the social media ...",https://i.ytimg.com/vi/hKnbSZ3uNgU/default.jpg,UCRVsqvXIdgyPVS-a6fGa1lA,2024-04-02T17:00:08Z
4oPj7hjPNhI,27,How Social Media Killed Traditional News | Oliver Luckett | Big Think,How Social Media Killed Traditional News New videos DAILY: https://bigth.ink Join Big Think Edge for exclusive video lessons ...,https://i.ytimg.com/vi/4oPj7hjPNhI/default.jpg,UCvQECJukTDE2i6aCoMnS-Vg,2017-01-21T17:15:31Z
CzHkdNC46KY,27,Google Listing Me Social Media Links Kaise Jode? | Professional GMB Tips,"Google Listing me social media links kaise jode, ye ek kafi dino se pucha ja raha question hai. isliye aaj jante hai ki in social ...",https://i.ytimg.com/vi/CzHkdNC46KY/default.jpg,UCyTJlqFJqj6xQJSPG4JHWsQ,2020-09-08T07:08:13Z
C9oAH4itXVE,27,Does Modern Social Media Make People Less Socially Active?,"Thank you for watching ""Does Modern Social Media Make People Less Socially Active?"" Please subscribe to our channel and ...",https://i.ytimg.com/vi/C9oAH4itXVE/default.jpg,UCvC3Ny0b3B4ZWfeJq9Kq3MQ,2023-01-08T23:22:11Z
4WLMOyBMozY,27,We are teaching social media managers and business owners FOR FREE 💪 #shorts,"Everything in one place. Plan your social media content, review your data, and manage your online ad campaigns. Analyze ...",https://i.ytimg.com/vi/4WLMOyBMozY/default.jpg,UC0NjePvj-YE5qeysRNfY-gA,2022-02-08T00:27:56Z
QsN3B41NsBM,27,Masters en Social Media - IEBS Business School,Fórmate para alcanzar el éxito en social media como Community Manager. Descubre nuestro Master en Community ...,https://i.ytimg.com/vi/QsN3B41NsBM/default.jpg,UCFsYIi-WCNYzvXO9q-HVz9A,2015-10-02T08:37:56Z
BkuWUVbBun0,27,Advice from a Lawyer ~ Social Media &amp; Your Job,Attorney Erin Zettle (and Family Literacy Center Board Member) will help guide you on many of the legal pitfalls you may face in ...,https://i.ytimg.com/vi/BkuWUVbBun0/default.jpg,UCpnbb9VjE3karxg7fthq3kA,2024-04-09T18:51:25Z
CVVZlHSGr0Y,27,Episode 122: How to Use the Latest Social Media Trends to Grow Your Business,"Welcome to the Marketing 101 Podcast for Small Business Owners, where you will find practical tips and guidance on developing ...",https://i.ytimg.com/vi/CVVZlHSGr0Y/default.jpg,UCIYIejlVqBHh4ceu4B-iG7w,2024-04-10T10:00:09Z
7vV8FICPNKU,27,Depression detection using social media dataset machine learning,How to detect depression using social media data using machine learning classifiers.,https://i.ytimg.com/vi/7vV8FICPNKU/default.jpg,UCJRUOPA8H2aqRUEPc-H387g,2022-01-13T18:29:29Z
Pr0EsNXYm4Y,27,Real Estate Banner and Social Media Post Design in Photoshop  Hindi Tutorial,I am going to teach you how to design Banner or social Media post in Photoshop cc by using simple real estate images and ...,https://i.ytimg.com/vi/Pr0EsNXYm4Y/default.jpg,UCMXQVRoJpMOVTS_eVD37PrQ,2020-05-01T14:21:50Z
pJY8O2eYktw,27,Boutique  | Online Business Marketing through social media,Facebook & IG beginners technique. How to market on Facebook and Instagram. How to market your online boutique. Influencers ...,https://i.ytimg.com/vi/pJY8O2eYktw/default.jpg,UC3PQoqNwZaGlRsFioxZATpA,2019-07-21T20:34:06Z
7IkbKHQafVI,27,The Best Website for Free PSD Social Media Instagram Post Banner Design Templates,PsFiles.com you can get a premium quality social media and Instagram Post and Banner Design PSD Template for Free.,https://i.ytimg.com/vi/7IkbKHQafVI/default.jpg,UC5ljhWJPiptmD7yoU6o4bTw,2022-02-14T15:36:04Z
-IYhGiL3N1E,27,Best Free Social Media Management Tools 2022 | How to Use Buffer for Social Media | KHR Services,AOA Welcome to KHR Services. This video will teach you about the best free social media management tools for 2022. You will ...,https://i.ytimg.com/vi/-IYhGiL3N1E/default.jpg,UCZp_zQPWVOJ9i9OMcD8oAtA,2022-06-20T13:00:36Z
nYYY7eYeW5c,27,ACT OF BETRAYAL | Cheating mixer grinder repair man | Social Media Awareness | Invisible Eye,Disclaimer - Please be aware that this Channel features scripted dramas and parodies to Aware People in Different Situations.,https://i.ytimg.com/vi/nYYY7eYeW5c/default.jpg,UCrKdVbnyrQCWQpLw0UxhbZw,2023-08-20T05:30:12Z
Hc1W21oxpFs,27,সোশ্যাল মিডিয়া মার্কেটিং এর কাজ কিভাবে করবেন || Complete Social Media Marketing Full Course Bangla,সোশ্যাল মিডিয়া মার্কেটিং এর কাজ কিভাবে করবেন || Complete Social Media Marketing ...,https://i.ytimg.com/vi/Hc1W21oxpFs/default.jpg,UCUCligxrNhdFgbzqAtwfmMw,2023-03-12T19:48:55Z
ZJP6o8CAc5k,27,I nostri webinar. Promuovi il tuo business sui social media.,24 marzo 2020 - #iorestoacasa con i nostri webinar. Argomento? Promuovi il tuo business sui social media. Obiettivo: Conoscere ...,https://i.ytimg.com/vi/ZJP6o8CAc5k/default.jpg,UCOiUXHoMpQ0YmnRAN4cCgHQ,2020-03-24T14:53:23Z
siEko0Tb3uo,27,What’s Hot &amp; Not in Social Media for Real Estate in 2023,What's Hot & Not in Social Media for Real Estate in 2023 | Tom Ferry Podcast Experience On this episode of the Tom Ferry ...,https://i.ytimg.com/vi/siEko0Tb3uo/default.jpg,UC3ZAfS1Z3J_Itfy7Rp745cg,2023-03-01T10:00:36Z
nJG1J8A73rA,27,This is why your business isn’t growing on social media #shorts,Social media tips from a social media manager:) . Hit the subscribe button to learn more . //Looking for a social media manager ...,https://i.ytimg.com/vi/nJG1J8A73rA/default.jpg,UCXwU2AaO5t3jhOG6_ZiKxXg,2022-04-06T14:22:04Z
fnHs0DvA6HI,27,Social Media Management Tools in Telugu,Join our Practical Digital Marketing course in Telugu at https://digitalbadi.com/digital-marketing-course-in-telugu/ ...,https://i.ytimg.com/vi/fnHs0DvA6HI/default.jpg,UCoBm1ENnEdo0cZ77qzcHleA,2017-12-02T06:49:57Z
kMQV9bUXNZA,27,Using Social Media for Drip Campaigns | Essential Tips for Real Estate Agents,"Rachel Adams Lee has learned how to pivot her drip campaign efforts, focusing on her social media platforms. She and Jay ...",https://i.ytimg.com/vi/kMQV9bUXNZA/default.jpg,UCxViDXGTXVVfgLQJZUquM7A,2022-10-05T15:00:33Z
9aOrSDnO9p0,27,Modicare Business opportunity को Social Media पर कैसे PROMOTE करें ?,In this video you will know about how to do modicare business on social media Course Link- https://imojo.in/9618Lc Modicare ...,https://i.ytimg.com/vi/9aOrSDnO9p0/default.jpg,UCgubtxW2jQcaEqiLY6C-wtw,2020-10-09T02:30:01Z
W6WB5-eD8B4,27,What is Social Media?,"This video explains what social media is. Put simply, social media refers to websites and apps that enable individuals, businesses ...",https://i.ytimg.com/vi/W6WB5-eD8B4/default.jpg,UCI8Xs2oPTMb9DkuYsEqCnnQ,2022-02-10T03:07:23Z
0x3QIt1IOKQ,27,Small business hack for social media📱 easy way to plan out your IG feed #smallbusiness #shorts,Small business hack for social media   easy way to plan out your IG feed #smallbusiness #shorts Subscribe to Adobe Express: ...,https://i.ytimg.com/vi/0x3QIt1IOKQ/default.jpg,UCn5CtwAo7oeHULdlVl-HMKw,2022-09-08T23:37:36Z
qajv1_rDxX0,27,Canva Tutorial in Tamil  - Fastest Way to Create Multiple Social Media Branding Designs Using Canva,Canva Tutorial in Tamil - Fastest Way to Create Multiple Social Media Branding Designs Using Canva Are you tired of spending ...,https://i.ytimg.com/vi/qajv1_rDxX0/default.jpg,UCj_LTLyAM1BYU-Kme7qEumg,2023-03-14T02:30:06Z
ak-vZQvBGOo,27,Business in Canada | Growing business using Social Media to make $1M with @AviArya &amp; @sahaschopra,"In this video, I talk to @AviArya and @sahaschopra about growing business in Canada using social media. They both are one of ...",https://i.ytimg.com/vi/ak-vZQvBGOo/default.jpg,UCunOjR0ZLh7wNTpXWcE17Gg,2023-05-04T07:49:23Z
9n186CL0q_4,27,Impotent tip for social media post creators | Photoshop Tutorial (Sinhala),ImpotentTip #PhotoshopSinhala #creativeartlk Video Editing Season 01 | Filmora- ...,https://i.ytimg.com/vi/9n186CL0q_4/default.jpg,UChn_3fE8-wRZdCp_-bD7MUA,2019-08-21T04:47:30Z
hLKMtWsqxNk,27,"How to Publish Social Media Post on Facebook, Instagram, Twitter in One Click","Everyone on social media accounts is looking to save time while posting. In this video, I will teach you how to published or ...",https://i.ytimg.com/vi/hLKMtWsqxNk/default.jpg,UCvnIZyTGZuoD1UZlcird9Dg,2021-08-05T16:47:54Z
iom2J-JK71A,27,Best Social Media Tools 2022 | FREE Tools for Social Media Marketing | #socialmediamarketingtools,In this video you will know amazing and most popular social media marketing tools in 2022. You can also learn complete digital ...,https://i.ytimg.com/vi/iom2J-JK71A/default.jpg,UCZbdK5v2VIj7qG6s7y3nDdw,2022-07-02T04:30:08Z
XWjN4Gs8Ar4,27,Bewakoof Case Study | Bewakoof Business Model | Social Media Marketing |Bewakoof Marketing Strategy,"In this video,the entrepreneural journey of Mr.Prabhkiran Singh is discussed.How he started his first business by his pocket money ...",https://i.ytimg.com/vi/XWjN4Gs8Ar4/default.jpg,UCWOXPBTFjt17LVax_VbRZ-w,2020-05-06T14:56:05Z
cXQi2fk2ujs,27,WEBINAR NASIONAL : Business and Social Media,"Business and Social Media”* Kamis, 25 Mei 2023, 13.00-16.00 WIB *WEBINAR NASIONAL* *Narasumber:* 1. Puspa Yudha ...",https://i.ytimg.com/vi/cXQi2fk2ujs/default.jpg,UCiMAZLQw5ymg5ftyV1eYv7Q,2023-05-25T21:48:13Z
2kc5-axtyd0,27,Social media marketing in 2024 | Social media marketing for Instagram,Looking to level up your social media marketing skills in 2024? This video dives into the world of Instagram social media ...,https://i.ytimg.com/vi/2kc5-axtyd0/default.jpg,UCmeF83cK6eGIS7kgYWntAtg,2024-04-02T18:42:47Z
-ln3xvSPVM8,27,"BHADRA RAJ YOGA CREATED BY MERCURY | BUSINESS, SUCCESS,SOCIAL MEDIA IN BIRTH CHART BY AMIT KAPOOR","BHADRA RAJ YOGA CREATED BY MERCURY | BUSINESS, SUCCESS,SOCIAL MEDIA IN BIRTH CHART BY AMIT KAPOOR ...",https://i.ytimg.com/vi/-ln3xvSPVM8/default.jpg,UCx6odiSMspqoRE_AyCfoluA,2020-08-20T02:46:06Z
nT2D9pHZNws,27,Social Media Bidding &amp; Google My Business,CodemanBD See Our Platforms & Contact Details: ================================ ➤ Our Online Freelancing Course ...,https://i.ytimg.com/vi/nT2D9pHZNws/default.jpg,UCMnzbcpENdPuKQbXFGluEqA,2023-06-23T18:03:25Z
qlmloTHPYcs,27,How to BLOW UP on social media in 2022 as a musician (REAL GEMS),Get the Essentials Midi kit here! https://gatekeepsounds.com/collections/all/products/essentials-drum-midi-kit ...,https://i.ytimg.com/vi/qlmloTHPYcs/default.jpg,UC4RKjNrEvh9uIuwIC7r3zSg,2022-09-23T19:00:11Z
QseOF3usquA,27,Die Zukunft von Social Media &amp; Online Business,"2021 wird sich vieles ändern - in Social Media, aber auch im Onlinebusiness-Sektor. Lass uns gemeinsam in die Glaskugel ...",https://i.ytimg.com/vi/QseOF3usquA/default.jpg,UCaeHFyaS8PxDEOZVw61xOpQ,2021-01-13T07:49:34Z
p-cMjSs2DRI,27,Expert Talk on Importance of Social Media in Business with K Ganesh &amp; Sachin Bhor in Hindi,Expert Talk on Importance of Social Media in Business with K Ganesh in Hindi Language. YouTube live session on 16th June ...,https://i.ytimg.com/vi/p-cMjSs2DRI/default.jpg,UCLa7qQpIUONwwMTKV_XZJeA,2021-06-17T00:16:51Z
GwP86plmGxg,27,How to Add Social Media Icons in Google My Business | Display on Google  Listing Profile,"How to add social media icons in google my business listing profile. Whenever the customer wants, the social media link can be ...",https://i.ytimg.com/vi/GwP86plmGxg/default.jpg,UCeOq05gbn5SUz6OtybePhhQ,2021-12-11T12:30:07Z
1ec7MFIL0g0,27,"No Creator is Real on Social Media, here&#39;s WHY | Drishti Sharma","When I was an audience on social media, I used to believe everything that was shown to me. I never thought that whatever the ...",https://i.ytimg.com/vi/1ec7MFIL0g0/default.jpg,UCdmDDJXog3qWbYAf7Gud8vQ,2022-10-02T15:19:00Z
p700mP2tGQ0,27,J4J Online Series 3: Journalism in The Age of Social Media,"J4J Online Series 3: Journalism in The Age of Social Media Reaching a huge audience is not impossible anymore, thanks to ...",https://i.ytimg.com/vi/p700mP2tGQ0/default.jpg,UCAPWRLJf-DtYAAp6qWwOrfA,2020-05-27T16:22:26Z
b8t60b4qCaI,27,What Goes Into a $3000 Social Media Marketing Package?,"Join Lucy Vincent, a seven-figure coach and agency owner, as she demystifies social media management pricing, guiding you ...",https://i.ytimg.com/vi/b8t60b4qCaI/default.jpg,UC4kJubKIlan0epFoxRmZBHQ,2024-04-09T14:00:33Z
tS7w5RLDyxs,27,Social Media Management Complete Course | Azad Chaiwala,PDF Link: https://www.mediafire.com/file/2n9gao... ✓ Course Recorded At | @AzadChaiwalaInstitute ✓ Teacher: Farrukh Mumtaz ...,https://i.ytimg.com/vi/tS7w5RLDyxs/default.jpg,UCi9X7f3IEQcKVHUKLlGikcQ,2024-04-09T23:45:03Z
3E8rgazsv3Y,27,$25m CEO Coaches me on How to Grow our Business - Ravi Abuvala: Scaling with Systems,Sponsored by Grammarly - ⚡️ Sign up and download for FREE using my link http://grammarly.com/deepdive. Sponsored by ...,https://i.ytimg.com/vi/3E8rgazsv3Y/default.jpg,UChfo46ZNOV-vtehDc25A1Ug,2024-04-04T14:00:04Z
JaBB1pxwyCA,27,What is Social Media Marketing || Social Media Marketing and Online Business Education,What is Social Media Marketing || Social Media Marketing and Online Business Education.,https://i.ytimg.com/vi/JaBB1pxwyCA/default.jpg,UCGCT5FbW3e2f0cvIdCPAk_g,2023-11-26T06:00:08Z
fiyzo2FMdoI,27,Leveraging Social Media To Grow Your Eyecare Practice,"As an optometrist, you want to make sure that your practice is not only attracting new patients but also retaining your existing ones.",https://i.ytimg.com/vi/fiyzo2FMdoI/default.jpg,UCP-bXbm_fr7A8Jch_4BQE_Q,2024-04-09T15:20:32Z
EH_vnkaQbao,27,उद्योजकांनी सोशल मिडीयासाठी वेळ का दिला पाहिजे ? Social Media For Small Business,हा व्हिडिओ तुम्हाला कसा वाटला ते कमेंट मध्ये लिहून अवश्य कळवा आणि ...,https://i.ytimg.com/vi/EH_vnkaQbao/default.jpg,UC1ZJMxWLx_JSRGCzJ1V7VdA,2017-09-28T13:01:14Z
hKnbSZ3uNgU,27,Can The Next Billion Dollar Social Media Platform Be Black Owned?,"In this enlightening episode of Earn Your Leisure, we delve deep into the groundbreaking journey of Fanbase, the social media ...",https://i.ytimg.com/vi/hKnbSZ3uNgU/default.jpg,UCRVsqvXIdgyPVS-a6fGa1lA,2024-04-02T17:00:08Z
FS3rAbhLn9Y,27,Real Estate Superstars: Tips and Tricks for Social Media Marketing with Top Producer Soomin Kim,"With over $100000000 in sales in less than two years, Social Media Ninja Soomin has some amazing tips for new and old Agents ...",https://i.ytimg.com/vi/FS3rAbhLn9Y/default.jpg,UC-X5-djftsCQFSZM8zDTGwg,2022-05-11T21:01:45Z
IshNntpXNec,27,Kim Kardashian&#39;s Marketing School 🤔 #Learn #Marketing #Business #Influencer #StreetCents,We investigate Kim Kardashian and North West's social media posts to see if the products in their videos are paid advertisements.,https://i.ytimg.com/vi/IshNntpXNec/default.jpg,UCbymQ2WsHDRzxTOjWFrjGFA,2024-04-06T14:00:20Z
2aMardjQFl8,27,How To Get More Sales On Social Media 📈 #business #contentcreation #sales,"Discover the untold story of how a simple video, far from perfect, skyrocketed my sales overnight! I'll share the raw, real journey ...",https://i.ytimg.com/vi/2aMardjQFl8/default.jpg,UC7QA4qQGESr4cNb6rt88Ryg,2024-04-04T13:00:02Z
TQ0d4Jusu90,27,Banner Design in Ms Word Hindi Tutorial || Website and Social Media Banner Design || Ready to Print,"Hello everyone, welcome to my channel. AD Real Tech brings you tutorials to provide you the computer education in operating ...",https://i.ytimg.com/vi/TQ0d4Jusu90/default.jpg,UC01sCa22i8CVRRUaXCZ2Ybg,2023-02-13T06:53:58Z
ewO2MsyyC-8,27,Pinterest Redbubble Integration Tutorial | Mehr Verkäufe durch Social Media | T-Shirt Business Tipps,"Du hast die Möglichkeit mit original meinen Designern & Researchern zusammenzuarbeiten, die mich bis hierhin gebracht haben ...",https://i.ytimg.com/vi/ewO2MsyyC-8/default.jpg,UC-LmD6z3rax5ifIxhRjB9zw,2021-08-10T15:00:20Z
F7k08t2pD3E,27,BJP&#39;s Washing Machine Explained | Corruption Cases,Follow me on LinkedIn: https://www.linkedin.com/in/mohakmangal/ ****** Sources: ...,https://i.ytimg.com/vi/F7k08t2pD3E/default.jpg,UCz4a7agVFr1TxU-mpAP8hkw,2024-04-06T11:11:38Z
1Nats6L3330,27,Impact Of Social Media For Business | Sandeep Chaudhary,"In this video, I am going to speak about the advantages of social media. If you are using social media then this video is for you.",https://i.ytimg.com/vi/1Nats6L3330/default.jpg,UCrx97_edlS0UHSiElj3Pmaw,2020-01-28T12:42:06Z
p-cMjSs2DRI,27,Expert Talk on Importance of Social Media in Business with K Ganesh &amp; Sachin Bhor in Hindi,Expert Talk on Importance of Social Media in Business with K Ganesh in Hindi Language. YouTube live session on 16th June ...,https://i.ytimg.com/vi/p-cMjSs2DRI/default.jpg,UCLa7qQpIUONwwMTKV_XZJeA,2021-06-17T00:16:51Z
