Video_id,Category_id,Title,Description,url_default,Channel_id,Publish_time
vGPTlklcdUM,27,3 Social Media Marketing Strategies GUARANTEED To Grow Your Business,Try CapCut Online here: https://shorturl.at/swDR3 ————————————————————————— MY FREE TRAININGS: ...,https://i.ytimg.com/vi/vGPTlklcdUM/default.jpg,UCKU0u3VbuYn0wD3CUr-Yn6A,2023-11-30T16:24:12Z
l3_HA0lBPu0,27,How To Start Marketing Your Small Business On Social Media In 2024,Download HubSpot's Official 10 Free Social Media Templates Kit Now [FREE RESOURCE] https://clickhubspot.com/2k4 Make ...,https://i.ytimg.com/vi/l3_HA0lBPu0/default.jpg,UCVeuau7DLrg7zlAjxxDbdww,2022-08-21T13:00:19Z
UtKmjGzRUb4,27,The Real Harm of Social Media,Then & Now is FAN-FUNDED! Support me on Patreon and pledge as little as $1 per video: ▻ http://patreon.com/user?u=3517018 ...,https://i.ytimg.com/vi/UtKmjGzRUb4/default.jpg,UCkS_HP3m9NXOgswVAKbMeJQ,2024-03-07T17:33:50Z
I2pwcAVonKI,27,Social Media Marketing In 5 Minutes | What Is Social Media Marketing? [For Beginners] | Simplilearn,Post Graduate Program In Digital Marketing: ...,https://i.ytimg.com/vi/I2pwcAVonKI/default.jpg,UCsvqVGtbbyHaMoevxPAq9Fg,2020-10-21T13:30:03Z
ieDWeQkPdlA,27,Social Media Musts for Every New Real Estate Agent,Social Media Musts for Every New Real Estate Agent The obvious way to achieve success in real estate is to have a ton of ...,https://i.ytimg.com/vi/ieDWeQkPdlA/default.jpg,UC3ZAfS1Z3J_Itfy7Rp745cg,2022-04-25T11:00:17Z
7QTe8IHqP0k,27,How to use Social Media to make BIG NETWORK MARKETING BUSINESS  | Zero To Millionaire | Deepak Bajaj,Watch this Video to Know Top 10 Best ways to grow your Network Marketing Business with the help of Social Media. ZERO TO ...,https://i.ytimg.com/vi/7QTe8IHqP0k/default.jpg,UCq5gIhlM7Vihj1ER1-SuE4A,2020-04-16T09:15:12Z
X_FY5FoS6_8,27,Dominate Social Media in 45 seconds With This Strategy,The home of all @garyvee videos All posts by @teamgaryvee ▻ Check out my main YouTube channel here: ...,https://i.ytimg.com/vi/X_FY5FoS6_8/default.jpg,UCOEMEjL1GBJ41uCWur5VXWQ,2022-08-11T20:00:06Z
-bQpsCMgCkA,27,How to Create Consistent Content on Social Media (100 posts in 30 days!),RESOURCES I CREATED FOR YOU! ⚡️   Notion Content Planning Dashboard: ...,https://i.ytimg.com/vi/-bQpsCMgCkA/default.jpg,UCdOPzgbosSnbfwd9-iXP2NA,2022-07-10T16:00:01Z
IHyELexHB1E,27,Social Media Marketing Strategies for Real Estate Niche! (BEST STRATEGY + FREE REAL ESTATE FUNNEL),Social Media Marketing Strategies for Real Estate Agents! Learn the exact strategies that we have used to drive buyer and seller ...,https://i.ytimg.com/vi/IHyELexHB1E/default.jpg,UCUoXIkRM0FHQ9sWWHjNpYNQ,2022-08-30T15:16:22Z
wbZBVu1AQSQ,27,How to Choose the Right Social Media Platform for Your Business,HOW TO CHOOSE THE RIGHT SOCIAL MEDIA PLATFORM FOR YOUR BUSINESS // Do you know a great place to find new ...,https://i.ytimg.com/vi/wbZBVu1AQSQ/default.jpg,UCILKtzMkbG4hwqWS4YHOM-A,2022-11-08T14:00:26Z
tVwZEVsTclU,27,Can Schools Punish You For Social Media Posts?! #law #education,Can Schools Punish You For What You Say On Social Media?! Subscribe to @LawByMike law tips! Ft @JackLerner ⭐ Become a ...,https://i.ytimg.com/vi/tVwZEVsTclU/default.jpg,UCKmmERguliWTynG9OIoDhDw,2023-12-01T16:00:20Z
PmEDAzqswh8,27,You Will Wish You Watched This Before You Started Using Social Media | The Twisted Truth,This might be one of the most important videos I've edited in 2018. After everything that has been going on with the privacy crisis ...,https://i.ytimg.com/vi/PmEDAzqswh8/default.jpg,UCpmZQGTZXn9xd4nN59pbIWQ,2018-04-20T11:11:13Z
SjX3160MEPQ,27,Social Media for the Enterprise - A Business Case,"How is social media truly impacting businesses today? Why are many of the world's top brands—like Pepsi, Virgin, NHL, and ...",https://i.ytimg.com/vi/SjX3160MEPQ/default.jpg,UClKEOcBKOcphClAWHQkgeDA,2013-02-01T18:39:01Z
704F2u6RvZo,27,The Future Of Social Media Marketing,,https://i.ytimg.com/vi/704F2u6RvZo/default.jpg,UCOEMEjL1GBJ41uCWur5VXWQ,2022-10-13T15:40:38Z
n85LtfwaLHQ,27,Social Media Marketing for Real Estate Agents [NEW FOR 2023],"Guaranteed Leads, Listings, & Closings https://bit.ly/3GiH7Df Creating a social media marketing plan as a real estate agent can ...",https://i.ytimg.com/vi/n85LtfwaLHQ/default.jpg,UCuXovghMTETSm-amUsoX8iA,2022-11-29T20:19:12Z
Rsslgudnrdc,27,What to Post on Social Media for Real Estate HAS CHANGED [SECRET COMPETITIVE ADVANTAGE],"DO NOT MISS THIS ❌ If you want a massive unfair competitive advantage in your market as a Realtor, THIS is the ninja strategy ...",https://i.ytimg.com/vi/Rsslgudnrdc/default.jpg,UCIZwIF-RyQxQNroTd5AFKNQ,2022-09-26T12:00:12Z
oh_Wxai8zP4,27,Social Media for Realtors - Complete Step-By-Step Guide For Getting STARTED [ON ALL PLATFORMS],This is the blueprint for getting started on YouTube + TikTok + Instagram + Facebook + Google + LinkedIn... How to use social ...,https://i.ytimg.com/vi/oh_Wxai8zP4/default.jpg,UCIZwIF-RyQxQNroTd5AFKNQ,2023-09-25T12:00:49Z
TWvaDVmoB5U,27,How to Market a Restaurant on Social Media,In todays day and age you can directly market to people through direct messages on social media. Finding 50 people with the ...,https://i.ytimg.com/vi/TWvaDVmoB5U/default.jpg,UCOEMEjL1GBJ41uCWur5VXWQ,2019-01-16T22:21:36Z
XbOO-ZVRfSE,27,"99% of social media is TOXIC, why? | Social media addiction explained | Abhi and Niyu","In this video, Abhi and Niyu try to highlight how social media is slowly poisoning us and is taking complete charge of our lives.",https://i.ytimg.com/vi/XbOO-ZVRfSE/default.jpg,UCsDTy8jvHcwMvSZf_JGi-FA,2024-02-26T13:00:10Z
ICD43MGz6LE,27,How to become a social media manager with no experience in 2023,"In this video, I'm going to share everything you need to know to become a social media manager with no experience in 2023.",https://i.ytimg.com/vi/ICD43MGz6LE/default.jpg,UCE9z7cMay5cp5KYyjaBjniw,2022-01-12T13:37:34Z
lEW0g2b3k1c,27,My 7 Favorite Social Media Tools (That Are Free),"My seven favorite social media tools that are free. Do you know what the second, third, fourth and fifth most popular website have ...",https://i.ytimg.com/vi/lEW0g2b3k1c/default.jpg,UCl-Zrl0QhF66lu1aGXaTbfw,2022-08-20T14:00:18Z
QbvfNwBn_5s,27,How to Create The PERFECT Social Media Content Calendar Real Estate Agents [FREE TEMPLATE],FREE CONTENT CALENDAR FOR REAL ESTATE AGENTS INCLUDED ✓ If you are struggling to be consistent on social media ...,https://i.ytimg.com/vi/QbvfNwBn_5s/default.jpg,UCIZwIF-RyQxQNroTd5AFKNQ,2022-11-07T13:00:13Z
DcIgk94Fp6Y,27,Social media addiction - how it changes your brain | Luke Burgis | Big Think,"Social media addiction - how it changes your brain, with Luke Burgis Subscribe to Big Think on YouTube ...",https://i.ytimg.com/vi/DcIgk94Fp6Y/default.jpg,UCvQECJukTDE2i6aCoMnS-Vg,2021-11-28T17:00:13Z
SGfiqaVTSsc,27,Car Sales Training // Dominate Your Market With Social Media // Andy Elliott,If you're looking for the BEST sales training videos on YouTube you've found it! If you want to make more Money selling cars ...,https://i.ytimg.com/vi/SGfiqaVTSsc/default.jpg,UCIP99i3azLdyYRxnUkSLJ7g,2022-03-07T21:17:06Z
PSzuJqv9lv0,27,These Social Media Content Ideas Will Grow Your Business Overnight!,These Social Media Content Ideas Will Grow Your Business Overnight! Shop small business favorites: ...,https://i.ytimg.com/vi/PSzuJqv9lv0/default.jpg,UC4crP-vc-0gMoAqJk8kPPVA,2023-05-13T13:20:03Z
XfvORUhIJx8,27,BeReal is the only good social media app. Here&#39;s why,Why belate when you can bereal Streaming on twitch rn: https://twitch.tv/evanedinger Vlog channel ...,https://i.ytimg.com/vi/XfvORUhIJx8/default.jpg,UCT7H_xchRHaT9zr5GalIZVA,2022-12-09T19:26:03Z
KidPIWxB8u8,27,How to Onboard Clients for Your SMMA / Social Media Marketing Agency,"How to Onboard Clients for Your SMMA : Social Media Marketing Agency In this video, we cover what you need to know to ...",https://i.ytimg.com/vi/KidPIWxB8u8/default.jpg,UCUoXIkRM0FHQ9sWWHjNpYNQ,2022-11-08T14:49:31Z
5st1t7pKG3E,27,How I DOUBLED my business by QUITTING Instagram | Marketing WITHOUT social media,Fun fact: I quit using instagram to market my creative business and that's when I actually had my first $10k month! Are you tired of ...,https://i.ytimg.com/vi/5st1t7pKG3E/default.jpg,UChQY-wgfhCc0_HGrZFPsgug,2022-05-04T16:00:02Z
pK4fClcDimc,27,These Ai Tools Automate 90% Of Your Social Media,"(JOIN WAITLIST) If you're ready to build and scale an agency and want to shortcut your path to building a profitable agency, join ...",https://i.ytimg.com/vi/pK4fClcDimc/default.jpg,UCy7eWrdNFG9yQob9zHCz5mQ,2023-04-03T16:16:17Z
1P-WiYh7l3U,27,WHAT TO POST ON SOCIAL MEDIA IF YOU SELL DIGITAL PRODUCTS . TIKTOK AND REELS IDEAS FOR DIGITAL ITEMS,In today's video we are talking about what to post on social media if you sell digital products and I'm giving you tiktok and reels ...,https://i.ytimg.com/vi/1P-WiYh7l3U/default.jpg,UCn5dbRDd31p2_ISUYX4hwJQ,2023-02-16T00:45:15Z
psaAHdfGHf8,27,What Social Media Platforms Should I Use For My Business?,Q: Should I vlog to build my business on my personal page or my brand's page? ▻Watch the full #Askgaryvee episode here: ...,https://i.ytimg.com/vi/psaAHdfGHf8/default.jpg,UCOEMEjL1GBJ41uCWur5VXWQ,2017-06-09T22:31:32Z
xm6JZIqj18k,27,My friends Completely Deactivated their life from the Social Media,"shorts Hello Guy's Welcome to our Channel ""Think UPSC"" I hope this video helps you get one step closer toward your ambitions ...",https://i.ytimg.com/vi/xm6JZIqj18k/default.jpg,UCHYlZMedjSdB9LkABuHbW7A,2022-07-05T15:30:12Z
ij_xXZAhJPs,27,Why people are choosing to quit social media | BBC Ideas,Many people make an active choice not to be on social media. What motivates them to quit or detox from social media? Is social ...,https://i.ytimg.com/vi/ij_xXZAhJPs/default.jpg,UCDYT9mM3L_ByrPYMyl0MGGg,2020-05-15T14:15:01Z
g8q-Nq-ajx8,27,Social media and teenage health ⏲️ 6 Minute English,What are the risks of social media to teenage health and what can be done about them? Beth and Neil discuss this and teach you ...,https://i.ytimg.com/vi/g8q-Nq-ajx8/default.jpg,UCHaHD477h-FeBbVh9Sh7syA,2023-11-23T14:38:46Z
NqMTqy4X6h0,27,Neuroscientist: &quot;DELETE Your Social Media NOW!&quot; - Here&#39;s Why!,"Dr. Andrew Huberman describes the dangers of social media on your brain. As a neuroscientist, social media is a dangerous tool ...",https://i.ytimg.com/vi/NqMTqy4X6h0/default.jpg,UCHbq_l1qnuomfJCYQTsWf_Q,2022-10-31T11:30:12Z
c3-TH9uHrp8,27,5 EASY And FAST Ways To Create Social Media Content For Realtors,"Creating real estate content does NOT have to be time consuming, difficult or overwhelming. Let me break down 5 incredible ...",https://i.ytimg.com/vi/c3-TH9uHrp8/default.jpg,UCIZwIF-RyQxQNroTd5AFKNQ,2023-03-06T13:00:26Z
NztsDoasKU4,27,How I&#39;m Using Social Media for Network Marketing,"This is a very effective way to use social media to build your network marketing business. In fact, it's my absolute favorite. 00:00 ...",https://i.ytimg.com/vi/NztsDoasKU4/default.jpg,UCL_XR1vnmEXA6XJqykVP9IA,2022-11-19T17:00:07Z
3u6nYpznI9s,27,How to Become a Social Media Manager in 2024 (even w/ no experience),Learn step-by-step how to become a social media manager in 2024 even with no experience. I'm going to share with you how to ...,https://i.ytimg.com/vi/3u6nYpznI9s/default.jpg,UCSs1vWPc1-EBVBkuSbMSCvA,2023-11-21T13:00:06Z
gICkRubcBDk,27,How Social Media Is Changing Your Brain | 4 Major Impacts of Social Media on our Brains | in Hindi,"This is how Social Media changes your Brain, In this video i have talked about 4 major impacts of Social media on our Brain.",https://i.ytimg.com/vi/gICkRubcBDk/default.jpg,UCoWhIOUIUCeMxJw4XVbI_6A,2021-09-26T05:37:05Z
ol0v779BlAA,27,How To Master Paid Social Media Advertising Like A Pro,"Free Download: Social Media Advertising plan kit: https://clickhubspot.com/ypi In this video, HubSpot will be giving you the best ...",https://i.ytimg.com/vi/ol0v779BlAA/default.jpg,UCVeuau7DLrg7zlAjxxDbdww,2022-01-09T13:30:24Z
98dRHoH1t1M,27,Why Social Media Marketing Doesn’t Work (For Most People),"Why social media marketing doesn't work for most people? It doesn't matter if it is Facebook, or Instagram, or LinkedIn, or even ...",https://i.ytimg.com/vi/98dRHoH1t1M/default.jpg,UCl-Zrl0QhF66lu1aGXaTbfw,2022-07-16T14:00:09Z
vKM7nXeFL3Q,27,Social Media Strategy | Which platform should your business be on?,Not sure what your social media marketing strategy should be for your small business? All the platforms stressing you out?,https://i.ytimg.com/vi/vKM7nXeFL3Q/default.jpg,UCs7qwxT0HL2fLTtVrt4i45w,2016-07-05T11:00:02Z
KI7rv8eIZbk,27,A REAL Social Media Strategy Example + Walkthrough in 2023,"A REAL Social Media Strategy Example + Walkthrough in 2023 In today's video, I'm uncovering my comprehensive social media ...",https://i.ytimg.com/vi/KI7rv8eIZbk/default.jpg,UCSs1vWPc1-EBVBkuSbMSCvA,2023-09-15T17:30:38Z
zPvzsKwQRGc,27,ULTIMATE Social Media Marketing Plan for Real Estate Agents 2023 [EVERY PLATFORM],BRAND NEW Social Media for Realtors 2023 The ultimate Social Media Marketing Plan for Real Estate Agents on EVERY ...,https://i.ytimg.com/vi/zPvzsKwQRGc/default.jpg,UCIZwIF-RyQxQNroTd5AFKNQ,2022-04-27T12:00:30Z
RMVNt-_lMAg,27,20+ Social Media Post Ideas to Radically Simplify Your Marketing,Do you struggle with planning your social media content? Wondering how to quickly and easily develop organic content that ...,https://i.ytimg.com/vi/RMVNt-_lMAg/default.jpg,UCS3lFRhXKfCZ8FvRqPjy9NA,2021-08-11T14:00:21Z
2d4D6Hs4Yxk,27,20 Social Media Tactics to Sell Homes FAST!,"Guaranteed Leads, Listings, & Closings https://bit.ly/3GiH7Df In this video, I, Chastin J. Miles, your go-to real estate agent, lay ...",https://i.ytimg.com/vi/2d4D6Hs4Yxk/default.jpg,UCuXovghMTETSm-amUsoX8iA,2019-02-01T21:43:15Z
bJj8XEw-zCg,27,How Social Media Destroys Your Life? | Science behind Addiction | Dhruv Rathee,"How many times do you scroll Instagram, YouTube, Facebook, or any other such social media platform in an hour? Probably ...",https://i.ytimg.com/vi/bJj8XEw-zCg/default.jpg,UC-CSyyi47VX1lD9zyeABW3w,2022-05-12T15:31:36Z
1Ev2FTrgVJg,27,Social Media for Business - Which Network is Right For You?,Social Media for business marketing http://www.leftclickrightclick.com In this video we look at the differences between the main ...,https://i.ytimg.com/vi/1Ev2FTrgVJg/default.jpg,UCVHNjtrbe3JfB7YY8e991FQ,2016-08-25T15:34:45Z
cKywnUGT_Kc,27,Understanding the Impact of Social Media,"Professor Huggy Rao, Lecturer Rob Siegel, MBA '94, and Michelle Cline, MBA '98, talk about the active use of social media and ...",https://i.ytimg.com/vi/cKywnUGT_Kc/default.jpg,UCGwuxdEeCf0TIA2RbPOj-8g,2020-06-02T20:05:55Z
4fpxpJej0Jk,27,The Dark Reality of Social Media!,This Is How Social Media Is Destroying Your Life - The Fake Reality --------------------------------------------- INSTAGRAM ...,https://i.ytimg.com/vi/4fpxpJej0Jk/default.jpg,UC1gDWPG73kPaiTdat8ypvAA,2021-12-20T11:35:53Z
iyKDjFZOrUQ,27,Why I Focus on Social Media Marketing Over SEO,"Why focus on social media marketing over SEO? You're probably surprised to hear this, after all, I'm mostly known for all things ...",https://i.ytimg.com/vi/iyKDjFZOrUQ/default.jpg,UCl-Zrl0QhF66lu1aGXaTbfw,2022-11-21T15:00:29Z
-Jqt61hiDtc,27,TOP 5 Social Media MARKETING PLATFORMS for Real Estate Agents During a RECESSION,The real estate market is CHANGING! So... Which Social Media Marketing platforms should you be focusing on RIGHT NOW if you ...,https://i.ytimg.com/vi/-Jqt61hiDtc/default.jpg,UCIZwIF-RyQxQNroTd5AFKNQ,2022-08-08T12:00:11Z
Zv1Tv82BcPE,27,Business: Digital and social media marketing,,https://i.ytimg.com/vi/Zv1Tv82BcPE/default.jpg,UC8FnEL1TvFCCrLn8hIAYiAA,2022-02-23T04:33:45Z
xm6JZIqj18k,27,My friends Completely Deactivated their life from the Social Media,"shorts Hello Guy's Welcome to our Channel ""Think UPSC"" I hope this video helps you get one step closer toward your ambitions ...",https://i.ytimg.com/vi/xm6JZIqj18k/default.jpg,UCHYlZMedjSdB9LkABuHbW7A,2022-07-05T15:30:12Z
MZyDwCBD69M,27,Best Social Media Platforms for Business [2023],"Here are the social media platforms for business that will be the best use of your time in 2023. We'll cover Instagram, TikTok, ...",https://i.ytimg.com/vi/MZyDwCBD69M/default.jpg,UC0gk8Jjvjf-HXFnAfCimsnQ,2023-02-09T22:37:12Z
3x9AWh7g1YQ,27,7 Social Media Hacks That’ll Make Your Business Grow Faster | Neil Patel,"Today I'm going to share with you 7 content creation hacks to grow your business faster. You're on Facebook, you're on Twitter, ...",https://i.ytimg.com/vi/3x9AWh7g1YQ/default.jpg,UCl-Zrl0QhF66lu1aGXaTbfw,2019-01-31T15:00:00Z
d07zTo_Ltqo,27,Social Media Marketing फ्री में सीखो | Earn 50K/Month | Free SMM Courses | Roadmap,"The world has changed and now it's time for you to change too! Learn how to become a social media manager for free, tips to ...",https://i.ytimg.com/vi/d07zTo_Ltqo/default.jpg,UCsQ6_w5iUOUOMAUPclg2kcg,2022-10-02T15:51:18Z
sXn1GBgSpUQ,27,Find social media profiles FAST with this OSINT tool!,"In this tutorial, I'll show you how to use Sherlock to find social media accounts on over 300 websites! Great for doing OSINT!",https://i.ytimg.com/vi/sXn1GBgSpUQ/default.jpg,UCEahRMjdsR_6cwVc49p2ZkA,2023-01-21T12:18:05Z
Ej8gPK4_VTs,27,"Simple, Honest, and Wildly Successful Social Media Video for Real Estate","Simple, Honest, and Wildly Successful Social Media Video for Real Estate Creating wildly successful social media videos as a ...",https://i.ytimg.com/vi/Ej8gPK4_VTs/default.jpg,UC3ZAfS1Z3J_Itfy7Rp745cg,2022-10-03T11:00:08Z
31yF8eJJ8z0,27,Why I quit social media - my advice for artists and creatives,"UPDATE November 2021: There have been a lot of questions and comments about this video recently, although it's from 2019.",https://i.ytimg.com/vi/31yF8eJJ8z0/default.jpg,UCqLQnIaHOKeHrjZVeszhA1Q,2019-10-24T14:42:15Z
r-Zf30Jx8qk,27,Code of Ethics and Business Conduct Social Media Scenario,This is a compliance scenario from one of our Code of Ethics and Business Conduct online training courses. This scenario ...,https://i.ytimg.com/vi/r-Zf30Jx8qk/default.jpg,UCswEPsnNjKSBJT4ErTxV-7g,2019-01-04T16:37:33Z
s6nHEM54VL0,27,Creating Vertical Real Estate Videos or Reels for Social Media,In this video I go over the process of creating videos in vertical orientation for real estate for use on social media platforms such as ...,https://i.ytimg.com/vi/s6nHEM54VL0/default.jpg,UCIVbHSVBLE_z9sIrn0tqxbA,2023-02-13T22:22:33Z
FBpCSDvHfj4,27,How To Market Your Woodworking Business On Social Media,"To get your free copy of Zach's Ebook “Handmade Business Secrets”, Please click here ...",https://i.ytimg.com/vi/FBpCSDvHfj4/default.jpg,UC4lvPJb78E_MUOAug4w0_Bg,2023-02-27T14:00:07Z
iv4CUV8GndU,27,Is Social Media Good or Bad ? | Advantages and Disadvantages of Social media | Adrija Biswas,Today we are gonna talk about the pros and cons of social media and the role it plays in our society. You can also use this video ...,https://i.ytimg.com/vi/iv4CUV8GndU/default.jpg,UCrbQKtL47yzrnUjdqhQJ8TA,2023-02-04T14:30:07Z
D-hfFocz5OY,27,Popular Social Media Channels for your Business (Explained),Learn more about social Media Channels Explained and get certified for Free: https://clickhubspot.com/SM-Course Crystal King is ...,https://i.ytimg.com/vi/D-hfFocz5OY/default.jpg,UCVeuau7DLrg7zlAjxxDbdww,2019-11-11T18:30:00Z
-nrJqmtO5SM,27,CANVA Real Estate social media and design tips 🔥BONUS TEMPLATES🔥,"Welcome to Canva for real estate agents! If you wish there was a Canva real estate course, here's the cliff notes. This video is ...",https://i.ytimg.com/vi/-nrJqmtO5SM/default.jpg,UCcDbEj1oZ4l43mu3jdf_8cQ,2022-01-27T17:25:42Z
PDxMLYCOWyM,27,Social Media Marketing for Beginners - Instagram,Sign up here for Digital Marketer School: https://digitalmarketerschool.com Free social media content guide and planner: ...,https://i.ytimg.com/vi/PDxMLYCOWyM/default.jpg,UCl0Na-giucIFjh2I9cqOnmw,2022-10-12T10:17:32Z
6gWXO18h7LI,27,Should Every Business Do Social Media Marketing?,We've been living in the digital age for quite some time now – but a lot of businesses STILL don't have a social media marketing ...,https://i.ytimg.com/vi/6gWXO18h7LI/default.jpg,UCAxtC6D1jmgpWg53fuczKtw,2019-04-09T03:00:00Z
XVCZZazGBK8,27,6 REASONS Why Your SOCIAL MEDIA is not GROWING | SOCIAL MEDIA MARKETING | DEEPAK BAJAJ,"BOOK YOUR SEATS NOW AT SPECIAL OFFER PRICE : https://pages.razorpay.com/SMWorkshop Queries - 9990555068, ...",https://i.ytimg.com/vi/XVCZZazGBK8/default.jpg,UCq5gIhlM7Vihj1ER1-SuE4A,2023-04-21T14:30:10Z
1eGLnGEo1fk,27,Using Social Media for Market Research,YouTube Description Blog post link: https://www.atkasa.com/blog/ Website Link:https://www.atkasa.com/ Understand Your Target ...,https://i.ytimg.com/vi/1eGLnGEo1fk/default.jpg,UCAYSpn503v_Ni_iWjUIZLDA,2022-10-21T13:05:03Z
nqprai0S130,27,5 Social Media Video Ideas for Real Estate Agents,"Real estate agents need to be online in their own videos, but most agents don't have time to Remember that real estate videos ...",https://i.ytimg.com/vi/nqprai0S130/default.jpg,UCdz6xAhGvoANd_9vVmFfWfg,2020-02-10T17:00:11Z
98dRHoH1t1M,27,Why Social Media Marketing Doesn’t Work (For Most People),"Why social media marketing doesn't work for most people? It doesn't matter if it is Facebook, or Instagram, or LinkedIn, or even ...",https://i.ytimg.com/vi/98dRHoH1t1M/default.jpg,UCl-Zrl0QhF66lu1aGXaTbfw,2022-07-16T14:00:09Z
U0keUj6EoDM,27,What does a Social Media Manager Really Do |  FREE Social Media Management Tasks Checklist PDF [Eng],"Hello Bosses! Are you curious about what Social Media Managers/Marketers do? If you are an aspiring or newbie SMM, this ...",https://i.ytimg.com/vi/U0keUj6EoDM/default.jpg,UCqOY9zsZrrd7MMYN-m8kcag,2022-06-21T11:00:11Z
4uu0_R4fjEo,27,How to Improve Social Media Marketing For HVAC &amp; Plumbers | Home Service Contractor Marketing,"HVAC, Plumbers, & Electricians can use social media marketing to grow your business. In this episode of ContractorCast our ...",https://i.ytimg.com/vi/4uu0_R4fjEo/default.jpg,UCYQaDoeQTW_6cUuE7mDBI0g,2021-03-05T13:52:11Z
uO0Lv_czNLM,27,7 Social Media Marketing Tips to Promote Your Hotel,"The rise of social media platforms like Facebook, Twitter, LinkedIn, and Instagram has meant that social media marketing is now ...",https://i.ytimg.com/vi/uO0Lv_czNLM/default.jpg,UCfMhyj6PF88ZrfilrAx0GRg,2022-02-02T00:20:28Z
GTo8ri1MhxU,27,The Rise of Anti-Social - Social Media Stars ... Like Elvish Yadav &amp; Rajat Dalal | Akash Banerjee,This has become a new beat for the police - handling chaapri influencers who are high on testosterone and low on respect for the ...,https://i.ytimg.com/vi/GTo8ri1MhxU/default.jpg,UCmTM_hPCeckqN3cPWtYZZcg,2024-03-18T16:15:48Z
VaYO7iSa78M,27,Social Media Marketing For Hotels | Get More Customers For Hotels Using Social Media,"Social Media Marketing for Hotels - Sounds like a lot of people already do! Well, the answer is NO! Hotels often end up doing ...",https://i.ytimg.com/vi/VaYO7iSa78M/default.jpg,UCRZhV5DzrHtm5u_guiMaxIQ,2022-12-23T14:30:35Z
MlkVTjBH6SM,27,Why Contractors Should NOT Outsource Their Social Media Marketing,You need to take ownership of your brand and content - not some freelancer or agency who doesn't know or care about your ...,https://i.ytimg.com/vi/MlkVTjBH6SM/default.jpg,UC_vekK71eCEFTioVcQ1y4Xg,2023-02-14T18:17:53Z
fA8o7Dst8Qc,27,"HOW TO MAKE MONEY &amp; GROW ON SOCIAL MEDIA IN 2024 (even with 0 followers) Instagram, YouTube, TikTok","If you're wondering how to make money and grow on social media FAST in 2024, this video is for you. Even if you have 0 ...",https://i.ytimg.com/vi/fA8o7Dst8Qc/default.jpg,UCS4VWcCVVI8Bcn8Dteylxzw,2022-06-12T14:00:28Z
fX1nJzvyWlw,27,Dark Truth Of Social Media Business: How Mark Zuckerberg Became A Billionaire?,Dark Reality Of Instagram - https://youtu.be/-lx6tC9PuZ0 Dark Truth Of Social Media Business: How Mark Zuckerberg Became A ...,https://i.ytimg.com/vi/fX1nJzvyWlw/default.jpg,UCUC3MxBlewPHrnc8QuvJd9w,2023-09-28T12:55:10Z
mzrY88g09Ic,27,The Untold Truth About Social Media For Small Businesses,"There's a reason most small businesses struggle to get results with social media, and it's one nobody seems to be talking about.",https://i.ytimg.com/vi/mzrY88g09Ic/default.jpg,UC5i1U95Udd4RYblltKRV9-A,2020-03-16T12:45:00Z
SZPbJ1NDqX8,27,Responsible Social Media Use in the Workplace,Learn more about employee social media use inside and outside of the workplace.,https://i.ytimg.com/vi/SZPbJ1NDqX8/default.jpg,UCLQG3H5YSNicv1kkGAUNFkg,2013-12-02T19:39:10Z
t1lvx1sA3QU,27,Social Media Marketing for eCommerce! The Expert&#39;s Guide For Growing Your Business By Social Media,"How to successfully promote eCommerce business in social networks? In our new video, we talk about - What mistakes ...",https://i.ytimg.com/vi/t1lvx1sA3QU/default.jpg,UCAEw4vIW4_D3rTLklNdsuqQ,2021-02-02T10:44:01Z
vLsR9rIrcts,27,The BEST Social Media Strategy for Real Estate Agents (2023),The BEST Social Media Strategy for Real Estate Agents (2023) *BRAND NEW* My 'AI' Agency System Currently Making Me ...,https://i.ytimg.com/vi/vLsR9rIrcts/default.jpg,UCBgPxTfodXMa_zavgl0DX7A,2020-12-09T19:30:07Z
4ut2EkAvVkI,27,How To Turn Engagement On Social Media Into Sales,How to turn engagement (likes and comments) on social media into clients and sales. Most businesses are leaving $1000's on ...,https://i.ytimg.com/vi/4ut2EkAvVkI/default.jpg,UCNnlg17shJjPLEm_z_zx0TA,2021-08-11T21:40:09Z
Ll5V4mFIXBE,27,"Fake News on Social Media - Difference in Disinformation, Misinformation &amp; Malinformation explained",Enrol to StudyIQ's Flagship UPSC IAS (Pre + Mains) LIVE Foundation Batch 9. Admissions closing on 10 DEC'22 | Enrol now ...,https://i.ytimg.com/vi/Ll5V4mFIXBE/default.jpg,UCrC8mOqJQpoB7NuIMKIS6rQ,2021-01-13T08:30:10Z
