Video_id,Category_id,Title,Description,url_default,Channel_id,Publish_time
M7pMVSv2DxU,27,Business Social Media Post Design In Photoshop | Photoshop CC Tutorial,Business Social Media Post Design In Photoshop | Photoshop CC Tutorial. Today I'm gonna show you How to create trendy social ...,https://i.ytimg.com/vi/M7pMVSv2DxU/default.jpg,UCD1y5LY99n0nirB6-9pN0hg,2021-09-26T04:45:00Z
VsUzmlZfYNg,27,"Build and Deploy a Full Stack MERN Social Media App with Auth, Pagination, Comments | MERN Course",Watch this video to master the MERN stack and build real industry applications. FREE Ultimate MERN Guide: ...,https://i.ytimg.com/vi/VsUzmlZfYNg/default.jpg,UCmXmlB4-HJytD7wek0Uo97A,2022-03-22T13:41:43Z
_om3tSDIyJs,27,"Social Media for Balloon Business with Sara Meyer, CBA - Q Corner Showtime LIVE! S03E07","We will be discussing the role and effective use of social media in the balloon industry. Our guest speaker, Sara Meyer, owner, ...",https://i.ytimg.com/vi/_om3tSDIyJs/default.jpg,UCKpbmelu5ImuvJyBj68cEXA,2023-04-20T06:08:36Z
jxmIwim8N1U,27,The Social Media Struggle Is REAL!,"No matter what industry you're in, the struggle is REAL. Don't you wish you had *more time* and less stress? I want to help! This is ...",https://i.ytimg.com/vi/jxmIwim8N1U/default.jpg,UCTFWKO9EiG1lumOBA8bjMsQ,2022-04-20T15:28:20Z
ENl-OdADY_0,27,Making Money From Social Media &amp; How To Structure Your Business by OPEN Forum,"For more info, please visit: http://www.openforum.com/yourbusinesstv Each week, MSNBC's Your Business features experts to ...",https://i.ytimg.com/vi/ENl-OdADY_0/default.jpg,UCAD48STRxYJVIfjHTZU7zIg,2015-02-22T12:30:00Z
0Vdk2GLhlY0,27,Social Media for Ag Business,This video provides an overview of ways you can use social media for your farm business.,https://i.ytimg.com/vi/0Vdk2GLhlY0/default.jpg,UCJBLYNMZSQQrotFPzrv6I7A,2018-08-15T13:42:57Z
R0J5s6bZT98,27,How Fake Social Media Account business works? Trade of buying fake likes and followers explained,Enrol to StudyIQ's Flagship UPSC IAS (Pre + Mains) LIVE Foundation Batch 9. Admissions closing on 10 DEC'22 | Enrol now ...,https://i.ytimg.com/vi/R0J5s6bZT98/default.jpg,UCrC8mOqJQpoB7NuIMKIS6rQ,2020-07-20T14:00:11Z
inpB7nnNKRM,27,Class 11th – Role of Technology and Social Media | Entrepreneurship | Tutorials Point,"Role of Technology & Social Media Lecture By: Ms. Madhu Bhatia, Tutorials Point India Private Limited.",https://i.ytimg.com/vi/inpB7nnNKRM/default.jpg,UCVLbzhxVTiTLiVKeGV7WEBg,2018-01-10T12:16:50Z
zDdUTkHPUwc,27,How are you showing up on social media for your business,The Networker Zone podcast episode 140 https://bigalbooks.com/podcast/episode140/ How to create a healthy network marketing ...,https://i.ytimg.com/vi/zDdUTkHPUwc/default.jpg,UChpghvG3nMUWFfiGT5YpBPw,2024-04-10T05:00:24Z
R8ef6lpyMB4,27,"Social Media for Architects - Interview with William J Martin, Architect","Find out more on http://businessofarchitecture.com/yt . In today's episode, we take on social media and web tools for architects.",https://i.ytimg.com/vi/R8ef6lpyMB4/default.jpg,UC7xCozKOVFdCZRV7gclrM6A,2013-09-17T16:51:56Z
W8jVgcXlhfQ,27,See How These Real Businesses Cut Social Media Workloads 80% (While Results Increased!),No more theory - let me show you actual businesses like yours that have dramatically cut their social media workloads (and seen ...,https://i.ytimg.com/vi/W8jVgcXlhfQ/default.jpg,UC5i1U95Udd4RYblltKRV9-A,2020-03-24T12:45:00Z
uDvtJTUT6xM,27,Social Media Dos and Don&#39;ts for Business | Do&#39;s and Don&#39;ts in Using Social Media | #socialmedia,"In this video you will get to know Best Practices for Social Media Growth, you should know what to do and what not to do while ...",https://i.ytimg.com/vi/uDvtJTUT6xM/default.jpg,UCZbdK5v2VIj7qG6s7y3nDdw,2022-03-24T11:45:01Z
8UUb-w9R8EM,27,Business with Brenberg: Should Government Regulate Social Media?,"Prof. Brian Brenberg, chair of the program in business and finance at The King's College, discusses the government's role in ...",https://i.ytimg.com/vi/8UUb-w9R8EM/default.jpg,UCY7IKuhznGwSIsrEMTsnZyg,2019-01-30T21:35:27Z
M7pMVSv2DxU,27,Business Social Media Post Design In Photoshop | Photoshop CC Tutorial,Business Social Media Post Design In Photoshop | Photoshop CC Tutorial. Today I'm gonna show you How to create trendy social ...,https://i.ytimg.com/vi/M7pMVSv2DxU/default.jpg,UCD1y5LY99n0nirB6-9pN0hg,2021-09-26T04:45:00Z
VsUzmlZfYNg,27,"Build and Deploy a Full Stack MERN Social Media App with Auth, Pagination, Comments | MERN Course",Watch this video to master the MERN stack and build real industry applications. FREE Ultimate MERN Guide: ...,https://i.ytimg.com/vi/VsUzmlZfYNg/default.jpg,UCmXmlB4-HJytD7wek0Uo97A,2022-03-22T13:41:43Z
GVWix4d26TY,27,Plastic Surgeon Reacts | Social Media isn’t REAL #skincare #cosmeticsurgery #antiaging #goviral,,https://i.ytimg.com/vi/GVWix4d26TY/default.jpg,UCSX6rAAUG6K4QGFRrKb5zCQ,2023-09-18T17:05:48Z
-hTOOWq5Tf4,27,Small Business... USE THESE Social Media Channels #shorts,Start & Scale A Successful Agency ➜ https://aerh.co/agency-accelerator Master Digital Marketing ...,https://i.ytimg.com/vi/-hTOOWq5Tf4/default.jpg,UCKU0u3VbuYn0wD3CUr-Yn6A,2022-09-25T12:47:24Z
_om3tSDIyJs,27,"Social Media for Balloon Business with Sara Meyer, CBA - Q Corner Showtime LIVE! S03E07","We will be discussing the role and effective use of social media in the balloon industry. Our guest speaker, Sara Meyer, owner, ...",https://i.ytimg.com/vi/_om3tSDIyJs/default.jpg,UCKpbmelu5ImuvJyBj68cEXA,2023-04-20T06:08:36Z
4KJZ9q9WrNs,27,11 Common MISTAKES Realtors Make on Social Media [YOU MUST AVOID ALL],"If you want to generate leads on social media as a Realtor and attract clients from your content, you MUST AVOID these 11 ...",https://i.ytimg.com/vi/4KJZ9q9WrNs/default.jpg,UCIZwIF-RyQxQNroTd5AFKNQ,2023-06-26T12:00:05Z
ENl-OdADY_0,27,Making Money From Social Media &amp; How To Structure Your Business by OPEN Forum,"For more info, please visit: http://www.openforum.com/yourbusinesstv Each week, MSNBC's Your Business features experts to ...",https://i.ytimg.com/vi/ENl-OdADY_0/default.jpg,UCAD48STRxYJVIfjHTZU7zIg,2015-02-22T12:30:00Z
0Vdk2GLhlY0,27,Social Media for Ag Business,This video provides an overview of ways you can use social media for your farm business.,https://i.ytimg.com/vi/0Vdk2GLhlY0/default.jpg,UCJBLYNMZSQQrotFPzrv6I7A,2018-08-15T13:42:57Z
inpB7nnNKRM,27,Class 11th – Role of Technology and Social Media | Entrepreneurship | Tutorials Point,"Role of Technology & Social Media Lecture By: Ms. Madhu Bhatia, Tutorials Point India Private Limited.",https://i.ytimg.com/vi/inpB7nnNKRM/default.jpg,UCVLbzhxVTiTLiVKeGV7WEBg,2018-01-10T12:16:50Z
_6WrThmoAe4,27,Stop Making These 6 Social Media Marketing Mistakes | Social Media Marketing Tips in Malayalam,Today we will discuss the Social Media Marketing Mistakes we need to avoid immediately. Social Media Marketing is one of the ...,https://i.ytimg.com/vi/_6WrThmoAe4/default.jpg,UC9h4cNQe9Cn34y_DHQ8-65Q,2020-08-13T07:55:51Z
zDdUTkHPUwc,27,How are you showing up on social media for your business,The Networker Zone podcast episode 140 https://bigalbooks.com/podcast/episode140/ How to create a healthy network marketing ...,https://i.ytimg.com/vi/zDdUTkHPUwc/default.jpg,UChpghvG3nMUWFfiGT5YpBPw,2024-04-10T05:00:24Z
Ai9Eg9arZQU,27,"Developing a Social Media Strategy for Your Business or Brand, Video 1 of 5",Develop a Social Media Strategy for your Business or Brand. Video series by Byron New Media http://byronnewmedia.com A ...,https://i.ytimg.com/vi/Ai9Eg9arZQU/default.jpg,UCytXKmELrlIpokzw-9mNB1g,2009-06-25T13:12:22Z
Mkww2jepy8Y,27,Social Media and Business Analytics Collaborative,"Professor and program director, Ravi Bapna, introduces the new University-wide Social Media and Business Analytics ...",https://i.ytimg.com/vi/Mkww2jepy8Y/default.jpg,UC26GdphINur1W_cV-ew4UhQ,2012-09-13T17:56:56Z
QOCGXqmv080,27,Presentation on the Importance of social media,"In this video,You can know about the importance of social media Presentation.This video is about the importance of social media ...",https://i.ytimg.com/vi/QOCGXqmv080/default.jpg,UCaRnBztFJWBJCcEOO72G0MA,2022-12-29T15:17:22Z
u6o7Uxr99Go,27,Do business schools look at your social media?,Kaplan Test Prep's 2017 survey of business schools across the U.S. finds a growing number tapping into social media to help ...,https://i.ytimg.com/vi/u6o7Uxr99Go/default.jpg,UCzvkVbN5y0gROfxURNJccXQ,2017-10-25T18:12:32Z
9xKC070T5Mc,27,Artists Shouldn&#39;t Build Their Business On Only One Social Media Platform - Walid Azami,SUBSCRIBE TO WALID AZAMI'S YOUTUBE CHANNEL http://ow.ly/SGUq30qckVL CONNECT WITH WALID AZAMI ...,https://i.ytimg.com/vi/9xKC070T5Mc/default.jpg,UCiYmiz5t4ZJ__CQMHMYSITA,2021-05-20T12:00:05Z
9bO_3Ld5VsY,27,Facebook Marketing Secrets TheSocialMediaMan Drive TrafficMedia Social Media Marketing Orange County,Facebook Marketing Secrets http://www.drivetrafficmedia.com/ for more information or Call 949-800-6990 for a free Social Media ...,https://i.ytimg.com/vi/9bO_3Ld5VsY/default.jpg,UC5fbvbuGGJSuYlXYn8_qPCA,2015-09-08T20:04:15Z
F-fsJpxey5c,27,दुनिया के 10 सबसे बड़े Application | Top 10 Biggest Social Media Apps In The World 2023 |,दुनिया के 10 सबसे बड़े एप्लिकेशन 2023 | Top 10 Biggest Social Media Apps In The World 2023 | Top ...,https://i.ytimg.com/vi/F-fsJpxey5c/default.jpg,UC9uNszDksWNnAyQycrcye8Q,2022-06-26T03:08:31Z
jEUedfsLEDg,27,Live Your REAL Life: The Relationship Between Social Media and Authenticity,"Social media is often referred to as a highlight reel. Posts on platforms like Instagram, TikTok and Facebook tend to depict only the ...",https://i.ytimg.com/vi/jEUedfsLEDg/default.jpg,UC7O6JLGxYuDJZw18SFwpnlw,2022-03-06T17:39:16Z
HOMTPjLlV_w,27,Dr Manpreet Singh Manna - Real Academic Research Will Come From Social Media Platforms,"Dr Manpreet Singh Manna (Director - AICTE) speaks to ASMA TV about the upcoming trends in academia, how SWAYAM MOOC ...",https://i.ytimg.com/vi/HOMTPjLlV_w/default.jpg,UCK-pgtlkqvTUYZfg5kSVl7Q,2018-09-11T08:30:48Z
CHN-5s4lmD4,27,Event Flyer Design Social Media | Photoshop Tutorial,How to design a social media flyer in photoshop. The Size is 1000 x 1000 pixel and also remember to always create web based ...,https://i.ytimg.com/vi/CHN-5s4lmD4/default.jpg,UCaZQ7Z5jaCMONdrt4FiR4xw,2022-11-19T09:05:00Z
n8aReBHwCQE,27,Debate on social media is good or bad,anilsir #glorious #gloriousinstitute #gloriousinstituteforenglish #jordansir #Debateonsocialmediaapplicationsaregoodornot ...,https://i.ytimg.com/vi/n8aReBHwCQE/default.jpg,UCo-IpEoXWMH8s9yv4dDzB2g,2022-06-12T11:30:03Z
1Qod4_ab8Nc,27,Paying Social Media Jobs Review | PayingSocialMediaJobs Site Real or Fake | Payment Proof Reality,Paying Social Media Jobs Site Review Watch till end to know whether Paying Social Media Jobs site is real or fake. For More ...,https://i.ytimg.com/vi/1Qod4_ab8Nc/default.jpg,UCKzOdmnVqnwShuDNzo1rugg,2023-06-25T05:50:52Z
pgT2myA5hk4,27,What is the real ROI on social media for your coworking space?,Everything Coworking Featured Resources: The SEO Action Guide ...,https://i.ytimg.com/vi/pgT2myA5hk4/default.jpg,UClS2_mQzkPeaks0JYoa3bFg,2022-08-03T05:00:30Z
zDlcAajJFyY,27,"Issues with Indian Media, Is Social media a real solution ? | Critical Analysis For UPSC/PCS",Enrol to StudyIQ's Flagship UPSC IAS (Pre + Mains) LIVE Foundation Batch 9. Admissions closing on 10 DEC'22 | Enrol now ...,https://i.ytimg.com/vi/zDlcAajJFyY/default.jpg,UCrC8mOqJQpoB7NuIMKIS6rQ,2022-04-08T15:00:12Z
UBeIQ9ItwLo,27,SOCIAL MEDIA COMMENT LEADS TO A  WARNING LETTER FROM THE UK GOVERNMENT,Beware of what you post in group chats and on social media. Heres how a simple social media comment led to a warning letter ...,https://i.ytimg.com/vi/UBeIQ9ItwLo/default.jpg,UCmcmIA2Mlhr7XmqUZy_4rZg,2024-04-09T09:54:21Z
QXXd25wsEAo,27,"Matrimonial Digital Marketing, SEO, Social Media, Website, Leads for Marriage Bureau | Gaurav Dubey","Here You Get Easy Ways To Promote Your Matrimonial Business Online with Latest SEO, Social Media, Google Ads, and ...",https://i.ytimg.com/vi/QXXd25wsEAo/default.jpg,UCkGU7-8u1zCLRHb5spjUaLQ,2022-12-14T06:25:17Z
p8C7GnsbFOQ,27,Is social media the best place to market your business?,,https://i.ytimg.com/vi/p8C7GnsbFOQ/default.jpg,UC5i1U95Udd4RYblltKRV9-A,2021-08-31T15:19:29Z
Oj9qFwrNTeE,27,Make More Money with Real Estate Business Models - Using Social Media -,Promoting your real estate business on social media is a prime place to prospect and generate leads. With so many clients using ...,https://i.ytimg.com/vi/Oj9qFwrNTeE/default.jpg,UCxViDXGTXVVfgLQJZUquM7A,2022-08-26T18:32:22Z
ECC8-QLFju8,27,Social Media Marketing Fundamentals for Business Growth || #socialmedia #marketing #businessgrowth,Here is Sprintzeal's video on Social Media Marketing Fundamentals for Business Growth Here is the link for read more about blog: ...,https://i.ytimg.com/vi/ECC8-QLFju8/default.jpg,UCzooKZaBjO85GF7DXL6SP4g,2024-04-09T09:46:32Z
DS7dgTEPZYk,27,Social Media and Democracy -Audio Article,SocialMediaAndDemocracy #SocialMedia #AudioArticle #CurrentAffairs #UPSC To buy Hindi Literature ...,https://i.ytimg.com/vi/DS7dgTEPZYk/default.jpg,UCzLqOSZPtUKrmSEnlH4LAvw,2020-12-04T12:46:40Z
jxmIwim8N1U,27,The Social Media Struggle Is REAL!,"No matter what industry you're in, the struggle is REAL. Don't you wish you had *more time* and less stress? I want to help! This is ...",https://i.ytimg.com/vi/jxmIwim8N1U/default.jpg,UCTFWKO9EiG1lumOBA8bjMsQ,2022-04-20T15:28:20Z
j91ABB4QJug,27,Social Media Marketing,Leadership and Management Skills : https://youtu.be/DG8XzNUsiF4 Legislative Practice and Procedure ...,https://i.ytimg.com/vi/j91ABB4QJug/default.jpg,UCcutVF5EuVy0H7boR07_aIA,2023-05-05T02:14:32Z
QFHAvFvEJzY,27,Social Media Background Checks - Privacy and human rights legal considerations,An overview of the privacy and human rights legal issues around using social media background checks as part of the hiring ...,https://i.ytimg.com/vi/QFHAvFvEJzY/default.jpg,UCK1JnZpphwTJZfsjW4Ng3mA,2022-01-06T13:00:20Z
ovfu-DvgaQo,27,Instagram for Beginners and Instagram Marketing in Telugu | Social Media Marketing in Telugu,Learn what is Instagram and How to start Instagram account and instagram marketing tips in Telugu. Explained all basic of ...,https://i.ytimg.com/vi/ovfu-DvgaQo/default.jpg,UCi9mn-c0K-3aCs6kpr9DfGw,2020-08-19T11:30:06Z
KYNPlckRXe8,27,Follow Us on Social Media! (UHBauerCollege),Follow the C. T. Bauer College of Business on all our social media platforms. Click - SHOW MORE- SUBSCRIBE TO OUR ...,https://i.ytimg.com/vi/KYNPlckRXe8/default.jpg,UCAtngoPSeBSZP0-LxiiDNww,2019-09-06T14:56:31Z
Ui6F7exdhrA,27,Social Media Outreach Made Easy With a Virtual Assistant,Social media outreach made easy with a Virtual Assistant for lead generation and sales. One of the best investments you can ...,https://i.ytimg.com/vi/Ui6F7exdhrA/default.jpg,UC-Uw1dq-YUdKSn0_5Lk4aPQ,2021-09-09T16:00:15Z
xO0e8dGlARo,27,SELBSTSTÄNDIG MIT SOCIAL MEDIA • Ein typischer Arbeitstag mit meinem Online Business  [Vlog],"Meine Freunde, es wird mal wieder Zeit für einen Einblick in meinen aktuellen Arbeitsalltag. Wie sieht der Arbeitstag aus, wenn ...",https://i.ytimg.com/vi/xO0e8dGlARo/default.jpg,UCr5nBoY2crloglA01ZmkETA,2022-03-02T16:00:25Z
sY0NWG3rV9M,27,20 Νέες τάσεις των Social Media το 2021 | Business Minds Live | Make Video Greece,Στο ⭐ [Business Minds Live] ⭐την Παρασκευή 29/01/21 στις 19:00μ.μ μαθαίνεις ποιές πλατφόρμες θα παίξουν καθοριστικό ρόλο ...,https://i.ytimg.com/vi/sY0NWG3rV9M/default.jpg,UCAn2ZQ4wU73ySWCEqK8njNg,2021-01-29T18:20:29Z
T3V8sZd4-Tw,27,Quick Tips for Social Media in Journalism from Laura Oliver,"Tips on the best way of using the big three social media platforms: Facebook, Twitter and Instagram. Laura Oliver is a digital ...",https://i.ytimg.com/vi/T3V8sZd4-Tw/default.jpg,UCtVI7L_1XIvPSwOr-YGaXDw,2019-10-18T14:06:16Z
Wl0_iJ-5Yl8,27,How to Design Product Banner Design in PowerPoint Tutorial || Social media Banner Design,"BannerDesign #DesignBaner #ProductBannerDesign Hello everyone, welcome to my channel. AD Real Tech brings you tutorials ...",https://i.ytimg.com/vi/Wl0_iJ-5Yl8/default.jpg,UC01sCa22i8CVRRUaXCZ2Ybg,2021-03-04T07:59:01Z
mRrc2aS_-qY,27,Coffee with Amy + Kevin: Smart Social Media,"In this episode of Coffee, Amy is joined by Katie Lance, social media strategist, author, and keynote speaker, to walk through all ...",https://i.ytimg.com/vi/mRrc2aS_-qY/default.jpg,UCuwHdbrl6jnRNzay-i35T6Q,2024-04-09T10:30:14Z
amU4HoD36KU,27,Social Media के ज़रिए कैसे बढ़ाएँ अपना Business🔥? जानिए कुछ Tips &amp; Tricks |OkCredit,सोशल मीडिया के ज़रिए कैसे बढ़ाएँ अपना बिज़नेस? जानिए कुछ टिप्स और ...,https://i.ytimg.com/vi/amU4HoD36KU/default.jpg,UCYRIzR9gXzrCObYW9defmow,2021-02-04T12:30:00Z
1kxioxpmXCQ,27,Social Media for Real Estate Agents: HOW TO ATTRACT CLIENTS - Lewi Gault,"If you want to know how to get clients on Social Media for real estate agents, this is the video for you! Lewi Gault and I discuss how ...",https://i.ytimg.com/vi/1kxioxpmXCQ/default.jpg,UCIZwIF-RyQxQNroTd5AFKNQ,2020-10-31T15:00:09Z
P8CKvyDrlQg,27,How to Measure ROI from Social Media | Ways to Calculate Return On Investment from Social Media #ROI,In this video you will learn How to measure ROI from Social Media. You can learn complete Digital Marketing FREE through our ...,https://i.ytimg.com/vi/P8CKvyDrlQg/default.jpg,UCZbdK5v2VIj7qG6s7y3nDdw,2022-06-24T11:30:06Z
frQ1Qwe6o_c,27,What to Post on Social Media for you Local Business in Albuquerque New Mexico,"Post to Engage! Show the Soul of your Business... What makes you unique in Albuquerque? Video, Pictures, Going Live, and ...",https://i.ytimg.com/vi/frQ1Qwe6o_c/default.jpg,UCxhpPsgf5YgkIW9oeg9RDPw,2018-03-17T22:52:31Z
JXnIM32kaEc,27,Social Media for Business Use Part 1 - Business Administration - Lesson 6 - Plato Training,This video is suitable for learners undertaking the business administration course with Plato Training.,https://i.ytimg.com/vi/JXnIM32kaEc/default.jpg,UC_od-E5g3mb0AvVTwvyTJIQ,2020-04-28T16:23:31Z
xmmqLmm5NKs,27,DO YOU NEED SOCIAL MEDIA TO GROW YOUR TEACHERS PAY TEACHERS BUSINESS?,"Someone asked this question, Do you need social media to grow your Teachers pay Teachers business? about 6-8 months ago ...",https://i.ytimg.com/vi/xmmqLmm5NKs/default.jpg,UCDKeWWwyZep_BAlU_SRyK5w,2021-09-25T14:30:18Z
gUKXfTdaW4E,27,Grow Your Business on Social Media || Small Business Marketing,SUBSCRIBE FOR MORE SMALL BUSINESS TIPS ...,https://i.ytimg.com/vi/gUKXfTdaW4E/default.jpg,UCTsSi3AJ7CPi0v8lghhRR3g,2022-08-28T14:00:18Z
vJrnH623z4c,27,How to Design Real Estate Banner for Social Media in Photoshop (Speed Art),Download File: https://bit.ly/3rSQlxW Learn how easy to Design Real Estate Banner for social media especially for Facebook ...,https://i.ytimg.com/vi/vJrnH623z4c/default.jpg,UCivlQSkVzn8CspkCSBlC0DA,2020-02-01T22:22:33Z
_BWcY7N5Ovw,27,How Social Media can Grow Your Business,shorts #shortsclip #shortscraft #youtube #youtuber #subscribe #shortsadoptme #shortsroblox #shortsanity #shortsbeta ...,https://i.ytimg.com/vi/_BWcY7N5Ovw/default.jpg,UCZ3vqJ-qN7Xre_iQnVAbMmQ,2023-03-23T20:20:12Z
Ie2MKk8-9JY,27,Frustrated marketing your business on social media?,,https://i.ytimg.com/vi/Ie2MKk8-9JY/default.jpg,UC5i1U95Udd4RYblltKRV9-A,2022-07-11T00:36:42Z
vlQCMLoqObA,27,ये 5 Social Media Platform आप के Business 10 Times Grow कर देंगे,To Join Live Youtube Mastery Program Call 7011309425 ➡️ Fill This Form Now To Join The Live Program ...,https://i.ytimg.com/vi/vlQCMLoqObA/default.jpg,UCr6hHjMNvgQxErQ1ZJV4drw,2020-01-08T11:08:48Z
gv9_u31n_6Q,27,Master en Marketing Digital y Social Media | INESEM Business School,El marketing está en constante cambio y aún este cambio es aún mayor si hablamos de marketing digital. El marketing digital ha ...,https://i.ytimg.com/vi/gv9_u31n_6Q/default.jpg,UC_mKfOCHV8cQgSjM2MorTgA,2019-08-01T07:02:27Z
NgGktGkL-uc,27,Real And Fake Things On Social Media #shorts #viral #reels #trending #tiktok,"reels #trending #tiktok #amazingfacts #colareffact #factsinhindi swimming to baby teaching swimming swimmers swim facts, world ...",https://i.ytimg.com/vi/NgGktGkL-uc/default.jpg,UCSnskV6Tccfqmsn2c4KC99w,2024-03-31T13:45:01Z
nlRgrfiSXC8,27,Innovative Social Media Campaigns,"Want more social media campaigns? Visit us at www.sparxoo.com (blog), http://bit.ly/aGG3wN (Facebook), ...",https://i.ytimg.com/vi/nlRgrfiSXC8/default.jpg,UCpad22b01PlqqtawFV8QNEw,2010-05-26T18:00:51Z
W5P2tLjGfoc,27,Real Talk with Miss Val - Social Media and Its Impacts,This recording originally aired live on Oct. 27 as part of a series of online programs provided by the UCLA Alumni Association.,https://i.ytimg.com/vi/W5P2tLjGfoc/default.jpg,UCUOWA12bkRYNbbFhyNSiiCA,2020-11-30T16:11:59Z
_6WrThmoAe4,27,Stop Making These 6 Social Media Marketing Mistakes | Social Media Marketing Tips in Malayalam,Today we will discuss the Social Media Marketing Mistakes we need to avoid immediately. Social Media Marketing is one of the ...,https://i.ytimg.com/vi/_6WrThmoAe4/default.jpg,UC9h4cNQe9Cn34y_DHQ8-65Q,2020-08-13T07:55:51Z
yWRXkGfHtLs,27,Social media people invite speech / vestige,,https://i.ytimg.com/vi/yWRXkGfHtLs/default.jpg,UCTyCH71ssuI8MXM69kwcp7A,2022-10-30T08:39:51Z
OiYSPX3QTpw,27,How to Add Social Media Profiles to Google My Business SERP | Digital Marketing in Tamil,For Digital Marketing Course Inquiry Contact our coordinator Mr. Guru Prasad t: 91-97892-28776. Free Digital Marketing Course.,https://i.ytimg.com/vi/OiYSPX3QTpw/default.jpg,UCCo-GuelGc-20pq7JEsIKeA,2019-07-25T07:30:02Z
nMJLJ6pX4L8,27,Boost Your Real Estate Social Media with Our Post Templates!,Download the FREE Guide: http://thepaperlessagent.com/social-media-posts-youtube Get The Definitive Collection of Social ...,https://i.ytimg.com/vi/nMJLJ6pX4L8/default.jpg,UCnCRkTW9M3LyWkjBFuKbpRA,2022-02-14T20:35:11Z
MlgBpM1k8Cg,27,How to create Real Estate Social Media Post Design in Adobe illustrator||Rasheed RGD,How to create Real Estate Social Media Post Design in Adobe illustrator||Rasheed RGD #rasheedrgd #graphicdesign ...,https://i.ytimg.com/vi/MlgBpM1k8Cg/default.jpg,UC15y9Ftzd-Y-L15W-mWfcKQ,2022-09-29T12:02:27Z
iXXjHRpDNA0,27,Suria Sparks with NursePreneurs (Build A Social Media Following For Your Business),Suria Sparks is the #1 influencer in Singapore. She has over 100 million followers across the globe and has mastered the art of ...,https://i.ytimg.com/vi/iXXjHRpDNA0/default.jpg,UCClxsnpX_wN-4ESGilioyeQ,2019-11-12T15:00:08Z
yW1J65_LGRY,27,Free Social Media Automation Tool | Buffer Tutorial,"In this video, I am sharing how to use Buffer for Social Media Automation and management. Super Valuable. Smart Recruitment ...",https://i.ytimg.com/vi/yW1J65_LGRY/default.jpg,UCjKJfnb09Dq3tx7CBNmXTag,2020-07-27T08:13:19Z
D35IHpSxC7A,27,Social Media Analytics And Ads By SEMRUSH | SEMRUSH Tutorials,"Social Media Analytics And Ads By SEMRUSH | SEMRUSH Tutorials In this series, explore the tools SEMRUSH can offer you to ...",https://i.ytimg.com/vi/D35IHpSxC7A/default.jpg,UCV1DOYf3nZgg5NMVpRIhrUA,2022-09-18T08:00:03Z
4iujZTVtZBc,27,How to create highly engaging posts on social media? | Digital Marketers are the next millionaires,How to create highly engaging posts/content on social media? | Digital Marketers are the next millionaires About Me: Facebook: ...,https://i.ytimg.com/vi/4iujZTVtZBc/default.jpg,UCw3jwyEmeiRdkS22sOjMsSA,2022-03-28T19:09:31Z
_aEjf_Cf7AI,27,Advantages and Disadvantages of Social Media [2020] | Merits and Demerits | Pros and Cons | Helsite,Advantages and Disadvantages of Social Media [2020]. What are the advantages of social media? Social media is an excellent ...,https://i.ytimg.com/vi/_aEjf_Cf7AI/default.jpg,UCfyRdx4J5vdNMu75eQl1KBg,2020-06-04T10:26:22Z
E689V7vUFqY,27,"Unit 2 Part 2, Blog, Blogging, Social Media Marketing, Digital and Social Marketing, Mobile Apps",Part 1| Digital Marketing (Theory): https://youtu.be/X-pCbWwu50k Part 2 | Digital Marketing (Theory): https://youtu.be/k3FGjRIjesQ ...,https://i.ytimg.com/vi/E689V7vUFqY/default.jpg,UChZKqB_5RTTgCbKDpQkyk2w,2021-03-21T05:24:10Z
LR3iKp5CbGE,27,With Interest: How your small business can use social media,"Social media can help you attract and keep customers, get customer feedback and retain loyalty. This podcast outlines the best ...",https://i.ytimg.com/vi/LR3iKp5CbGE/default.jpg,UCFQ0ZmQ4A2MMdyWmISemBdw,2024-04-08T23:55:34Z
aM8H4TQdL3w,27,E-Commerce Ad Design for Website &amp; Social Media in Canva Tutorial,"Hi, In this video you will learn how to create professional E-Commerce Product Ad design in canva. These are a few simple steps ...",https://i.ytimg.com/vi/aM8H4TQdL3w/default.jpg,UCd1r9jVDNrbQp3LJDG7gwHg,2022-08-01T07:09:08Z
c04bpueIZdc,27,You are too patient when marketing your business on social media!,,https://i.ytimg.com/vi/c04bpueIZdc/default.jpg,UC5i1U95Udd4RYblltKRV9-A,2022-07-05T22:30:55Z
4MpUR96nT2k,27,Digital business marketing social media post design |  Illustrator Tutorial,Digital business marketing social media post design | Illustrator Tutorial Download Design:- ...,https://i.ytimg.com/vi/4MpUR96nT2k/default.jpg,UCa5nr5E6MJE2WPhKqbmZa0A,2021-05-30T23:45:00Z
BO4V7r3NlKY,27,Real estate house social media post | CorelDraw Tutorial,Real estate house social media post | CorelDraw Tutorial SUBSCRIBE FOR MORE VIDEOS: https://bit.ly/36fRBC3 ...,https://i.ytimg.com/vi/BO4V7r3NlKY/default.jpg,UCezepuuvOq9fj8VjtoycBDA,2022-01-28T13:41:15Z
